game_id,id,value
248878,385241,FlickFleet: Big Box
248878,385244,FlickFleet: Playmat
248949,365942,Skull Tales: Full Sail! – Deck Boxes
248949,365945,Skull Tales: Full Sail! – Door and Chest Miniatures
248949,365943,Skull Tales: Full Sail! – Pirate Dice Set
248949,365948,Skull Tales: Full Sail! – Pirate Dice Tower
248949,365946,Skull Tales: Full Sail! – Sea Miniatures for Voyage Phase
249233,331403,Filler: Play Mat
249259,334828,War Chest: Laserox Organizer
249259,321148,War Chest: Meeple Realty Control Markers
249259,321149,War Chest: Meeple Realty Insert
249259,400960,War Chest: Playmaty rubber mat
249277,406534,Brazil: Imperial – Inserty Herman Insert
249277,396964,Brazil: Imperial – Metal Action Tokens
249277,360568,Brazil: Imperial – reDrewno Insert
249381,272508,The Estates: Meeple Realty Insert
249421,308272,Warfighter Pacific: Errata Card Deck
249421,358654,Warfighter WWII: Wave 01 and 02 Card Dividers
249421,396796,Warfighter: 2023 Update Kit
249421,358634,Warfighter: Battle Packs Wave 3 Card Dividers
249421,313752,Warfighter: Dice Pack
249421,278961,Warfighter: The WWII Pacific Combat Card Game – Korean War Playmat
249421,285051,Warfighter: The WWII Pacific Combat Card Game – Pacific Playmat
249421,214560,Warfighter: The WWII Tactical Combat Card Game – Expansion 13: Metal Tokens
249673,323304,Rolling Ranch: Stamps
249675,274675,Desolate: Game Mat
249677,386360,Gruff: Playmat
249689,325101,Sovereign Skies: Metal Energy Coins
249689,316739,Sovereign Skies: Playmat
249746,300302,Nanty Narking: Canvas Playmat
249746,321765,Nanty Narking: Card Holders
249746,377315,Nanty Narking: Deluxe Miniature Set
249746,321764,Nanty Narking: Metal Coins
249763,404201,Claim Playmat Limited Anniversary Edition
249763,404200,Claim: Playmat Tricksters
249763,329097,Claim: Spielmatte
249773,300949,Atlantic Storm: Admiral's Edition – Players Mat
249889,333791,Shipwrights of the North Sea: Laserox Organizer
250355,272944,All Manor of Evil: Playmat
250481,325838,Meltwater: A Game of Tactical Starvation – Canvas Map
250488,267570,This Guilty Land: Canvas Map
250664,299935,Godtear: Base Rings Sets
250664,299975,Godtear: Neoprene Playmat
250664,299934,Godtear: Translucent Smoke Dice Set
251131,285154,Lock 'N Load Tactical: Player Aids
251131,285155,Lock 'N Load Tactical: Quick Reference Flip Cards
251219,365875,Istanbul: Big Box – Tower Rex Organizer
251219,325279,Istanbul: Folded Space Insert (Second edition)
251219,338848,Istanbul: Moedas & Co. Metal Coins
251247,332735,Barrage: reDrewno Insert
251247,386434,Barrage: 3D Map
251247,374564,Barrage: e-Raptor Insert
251247,312897,Barrage: Folded Space Insert
251247,349830,Barrage: GolonkoCrafts Water Droplets
251247,326749,Barrage: Laserox Barrage Organizer
251247,313597,Barrage: Meeple Realty Wooden Wheels
251247,340076,Barrage: Metal Coins
251247,402795,Barrage: Moedas & Co. Metal Coins
251247,359668,Barrage: Saim Lab Insert
251247,382559,Barrage: Sloyca Insert
251247,350984,Barrage: The GiftForge Insert
251247,365828,Barrage: Tower Rex Organizer
251247,318011,Barrage: Wooden Machineries pack
251350,366609,Gem Rush (Second Edition): Custom Gem Bag
251412,297608,On Tour: Extra Player Board
251412,371834,On Tour: Rock Star Dice
251445,322247,The Perfect Moment: Solo Playmat
251535,351021,Invocación Fronteras: Playmat Oficial Invocador
251551,327830,Dale of Merchants: Playmat bag
251658,397256,Button Shy Game Haul Bag
251658,370191,Sprawlopolis: Expansion Collection – Wallet
251658,312548,Sprawlopolis: Greetings from Sprawlopolis Postcard
251658,307389,Sprawlopolis: Scoresheet
251661,402643,Oathsworn: Into the Deepwood – 1st to 2nd Edition Upgrade Pack
251661,402315,Oathsworn: Into the Deepwood – Amberlight Dice Set
251661,371408,Oathsworn: Into the Deepwood – Extra Set of Dice
251661,412392,Oathsworn: Into the Deepwood – Extra Standees
251661,410258,Oathsworn: Into the Deepwood – Heavy Metal Dice
251661,371406,Oathsworn: Into the Deepwood – Map Pack
251661,314493,Oathsworn: Into the Deepwood – Metal Coins
251661,314560,Oathsworn: Into the Deepwood – Mystery Chests
251661,410259,Oathsworn: Into the Deepwood – Oathstone Free Company Marker
251661,402314,Oathsworn: Into the Deepwood – Premium Faux Leather Dice Tray
251661,402313,Oathsworn: Into the Deepwood – Premium Pouch Pack
251661,402316,Oathsworn: Into the Deepwood – Secret Box
251661,314496,Oathsworn: Into the Deepwood – Terrain Pack
251661,314498,Oathsworn: Into the Deepwood – The Armory
251678,405689,Railroad Ink: Additional Players Pack
251678,407458,Railroad Ink: Embroidered Cloth Bag Pack
251678,340005,Railroad Ink: Giant Box
251723,272968,Zombicide: Invader – Plastic Token Pack
252153,367750,Tang Garden: Illustrated Sleeves
252153,270755,Tang Garden: Metal Coins
252153,368876,Tang Garden: Premium Sleeves Pack
252277,276773,Sparkle*Kitty: Blank Pack
252315,314514,The Everrain: Acrylic Tokens
252315,314518,The Everrain: Dice
252315,314512,The Everrain: Metal Coins
252328,403368,Star Wars: X-Wing (Second Edition) – Blue Squadron Scout Alternate Art Card
252328,309101,Star Wars: X-Wing (Second Edition) – Damage Decks
252328,281990,Star Wars: X-Wing (Second Edition) – Deluxe Movement Tools and Range Ruler
252328,322821,Star Wars: X-Wing (Second Edition) – Dice Pack
252328,271481,Star Wars: X-Wing (Second Edition) – First Order Conversion Kit
252328,252706,Star Wars: X-Wing (Second Edition) – Galactic Empire Conversion Kit
252328,289385,Star Wars: X-Wing (Second Edition) – Huge Ship Conversion Kit
252328,281993,Star Wars: X-Wing (Second Edition) – Maneuver Dial Upgrade Kits
252328,252704,Star Wars: X-Wing (Second Edition) – Rebel Alliance Conversion Kit
252328,271482,Star Wars: X-Wing (Second Edition) – Resistance Conversion Kit
252328,252707,Star Wars: X-Wing (Second Edition) – Scum and Villainy Conversion Kit
252328,263870,Star Wars: X-Wing (Second Edition) – T-65 Damage Deck
252328,173295,Star Wars: X-Wing Miniatures Game – Playmats
252399,358579,Vast: The Mysterious Manor – The Dicetroyers Organizer
252399,257506,Vast: The Mysterious Manor – Wooden Meeple Set
252446,282865,Keyflower: GeekUp Bit Set
252555,380510,Bad Maps: Deluxe Components
252556,306129,Bosk: Laserox Organizer
252556,348619,Bosk: The GiftForge Insert
252556,329399,Bosk: Winter Holiday Promo
252688,329267,Enchanters: Crystal Shards Set
252688,329266,Enchanters: Deluxe Storage Box
252688,329268,Enchanters: Neoprene Kit
252752,353035,Genotype: Add-on Pack with Collector's Edition Components
252854,291956,Sabotage: Meeples
252877,308224,Wreck Raiders: M3is3D Box Organizer
252929,320870,Planet: Mythical Creatures
253185,366742,Chai: Acrylic Pantry Tokens and Enlarged Bags
253185,366743,Chai: Acrylic Tip Tokens
253185,313308,Chai: Metal Coins
253185,313307,Chai: Playmat
253215,313782,Jetpack Joyride: Dry-Erase Board
253215,313639,Jetpack Joyride: Gripping Mat
253215,323035,Jetpack Joyride: Official Soundtrack Card
253344,360114,Cthulhu: Death May Die – Customeeple Dice
253344,342575,Cthulhu: Death May Die – e-Raptor Insert
253344,256989,Cthulhu: Death May Die – Extra Dice
253344,318488,Cthulhu: Death May Die – Feldherr Inlay
253368,341042,Kingswood: Metal Coins
253368,379174,Kingswood: Metal Start Player token
253368,317116,Kingswood: Playmat
253372,390601,Minerały: Zestaw alternatywnych pionków hexy
253372,328545,Minerały: Zestaw alternatywnych pionków kule
253499,401331,A War of Whispers: Miniatures Upgrade Pack
253607,279924,1822: 3D-Printed Tile Holders
253608,377227,18Chesapeake: Cube4Me Card Organizer Trays
253608,377229,18Chesapeake: Cube4Me Track Tile Organizer Tray Stickers
253608,377225,18Chesapeake: Cube4Me Track Tile Organizer Trays
253608,318325,18Chesapeake: Seahorse Organizer
253635,336068,Ragusa: Metal first player coin
253635,336029,Ragusa: Screen-Printed Components Set
253652,397076,Combat!: Replacement Maps
253743,293064,Fuji Koro: Dragon Health Pawn
253743,311213,Fuji Koro: Playmat
254110,369663,A Thief's Fortune: Cardboard Pouches
254110,369664,A Thief's Fortune: Royal Palace of Nabbarah Resin Miniature
254127,340212,Europa Universalis: The Price of Power – Bot Decks
254127,340213,Europa Universalis: The Price of Power – Dice Set
254127,297633,Europa Universalis: The Price of Power – Giant Play Mat
254127,340214,Europa Universalis: The Price of Power – Metal Coins
254192,396149,Harry Potter: Hogwarts Battle – Defence Against the Dark Arts: WarBox Insert
254226,329849,Unlock: GameGuard Organizer
254386,297576,Raccoon Tycoon: Metal Coins
254498,277010,Girl Genius: The Works – Playmat
254500,277010,Girl Genius: The Works – Playmat
254502,277010,Girl Genius: The Works – Playmat
254504,277010,Girl Genius: The Works – Playmat
254505,277010,Girl Genius: The Works – Playmat
254546,260036,Lost Galaxy: Playmat
254591,282276,Heroes of Terrinoth: Game Mat
254632,398293,Hyperspace: Art & Intel Book
254632,398289,Hyperspace: Dice pack
254632,398296,Hyperspace: Native aliens
254632,398285,Hyperspace: Starfield playmat
254632,398294,Hyperspace: Stasis Box
254683,393297,Dodos Riding Dinos: Survival Pack
254708,405006,Roll Player Adventures: 2nd Printing Update Kit
254713,394985,The Artemis Project: 2.0 Upgrade Pack
254713,319434,The Artemis Project: Insert Here Insert
254713,297592,The Artemis Project: Metal Expedition Badges
254743,350787,Theosis: Godslayer
254936,376475,Frontier Wars: Mini Expansion Buildings
254936,376476,Frontier Wars: Mini Expansion Trucks
255013,382541,Solo Fluxx Playmat
255037,344691,"Silk: ""Silkworm Shepherd"" Improvement Alternate Art Tile"
255191,339644,Fighter Command 2.0
255262,291175,Agricola: All Creatures Big and Small – The Big Box – Insert Here Insert
255262,264122,Agricola: Kuhflecken Sticker
255293,361863,One Night Ultimate Werewolf: Card sleeves
255363,338397,ArchRavels: Wooden Yarn Bowls
255363,338398,ArchRavels: Yarn Bazaar Playmat
255393,411222,GMT Games Errata Counters 2023
255400,255425,Traveller Customizable Card Game: Alternate Art Ship Card
255400,255418,Traveller Customizable Card Game: Collector's Edition Token Sets
255400,276052,Traveller Customizable Card Game: Playmats
255400,255408,Traveller Customizable Card Game: Premium Tokens
255507,264186,Orbis: Alternate God Tiles
255507,275466,Orbis: Neoprene Game Mat
255516,327290,Brave Little Belgium: Canvas Mat
255606,299051,Naval Warfare: Lord of the Sea Counter Set
255633,296269,Town Builder: Coevorden – Playmat
255635,412082,Pitch Out: Goodies tokens
255664,357935,The Binding of Isaac: Four Souls – 4-player mat
255664,304817,The Binding of Isaac: Four Souls – Unholy Rollers Custom Dice Set
255674,367087,KOSMOS Helper App
255675,367087,KOSMOS Helper App
255692,262000,Race for the Galaxy: GeekUp Bit Set
255902,318246,Napoléon 1807: Playmat
255984,302009,Sleeping Gods: Custom Metal Coins
255984,302010,Sleeping Gods: Flexible Battle Mat
255984,367210,Sleeping Gods: Laserox Organizer
255984,302012,Sleeping Gods: Metal Ship
255984,302011,Sleeping Gods: Realistic Resources
255984,397397,Sleeping Gods: The GiftForge Insert
255984,365795,Sleeping Gods: Tower Rex Organizer
256066,262049,"Warhammer 40,000: Kill Team – Adeptus Mechanicus Dice"
256066,262051,"Warhammer 40,000: Kill Team – Astra Militarum Dice"
256066,262060,"Warhammer 40,000: Kill Team – Datacards"
256066,262056,"Warhammer 40,000: Kill Team – Deathwatch Dice"
256066,262057,"Warhammer 40,000: Kill Team – Drukhari Dice"
256066,262050,"Warhammer 40,000: Kill Team – Genestealer Cults Dice"
256066,262059,"Warhammer 40,000: Kill Team – Necrons Dice"
256066,262053,"Warhammer 40,000: Kill Team – Orks Dice"
256066,262054,"Warhammer 40,000: Kill Team – Space Wolves Dice"
256066,262058,"Warhammer 40,000: Kill Team – T'au Empire Dice"
256066,262055,"Warhammer 40,000: Kill Team – Tyranids Dice"
256226,343443,Azul: Stained Glass of Sintra – Custom Glass Tower
256382,271928,Disney Villainous: Insert Here Insert
256382,352306,Disney Villainous: LaserLand Cauldron & Power Token Upgrade
256382,352415,Disney Villainous: LaserLand Cruella De Vil Token Upgrade
256382,352298,Disney Villainous: LaserLand Evil Queen Token Upgrade
256382,352299,Disney Villainous: LaserLand Fate & Locks Token Upgrade
256382,352300,Disney Villainous: LaserLand Gaston Token Upgrade
256382,352307,Disney Villainous: LaserLand Lady Tremaine Token Upgrade
256382,352301,Disney Villainous: LaserLand Mother Gothel Token Upgrade
256382,352302,Disney Villainous: LaserLand Pete Token Upgrade
256382,352303,Disney Villainous: LaserLand Prince John Token Upgrade
256382,352305,Disney Villainous: LaserLand Scar Strength Tracker Upgrade
256382,352416,Disney Villainous: LaserLand Special Movers Token Upgrade
256382,352417,Disney Villainous: LaserLand Strength Token Upgrade
256382,352304,Disney Villainous: LaserLand Villain Randomizer
256382,272501,Disney Villainous: Meeple Realty Insert
256382,378780,Disney Villainous: Spielmaterial.de Upgrade
256390,292793,Architectura: Playmat
256568,339745,Wyspa Przygód: Mata to gry
256589,299768,Rallyman: GT – Dice Pack
256589,396305,Rallyman: GT – Errata Pack
256589,396303,Rallyman: GT – Folded Space Insert
256640,256679,H.D.P. 0: Hasta Donde Puedas
256680,404890,Return to Dark Tower: Advantage Tokens
256680,360120,Return to Dark Tower: Card Sleeves
256680,367788,Return to Dark Tower: Coffers 2
256680,299208,Return to Dark Tower: Coin of the Realm
256680,367787,Return to Dark Tower: Covenant – Card Sleeves
256680,299205,Return to Dark Tower: Dark Horde
256680,299207,Return to Dark Tower: Neoprene Board
256680,370512,Return to Dark Tower: Skulls Pack
256680,299206,Return to Dark Tower: The Coffers
256707,373277,Trick Shot: 1st Edition Update
256707,335949,Trick Shot: Neoprene Game Board
256730,392840,Pipeline: Folded Space Insert
256730,329296,Pipeline: Metal Oil & Penalty Cubes
256742,257256,EXCEED: Playmat
256778,257256,EXCEED: Playmat
256779,257256,EXCEED: Playmat
256780,257256,EXCEED: Playmat
256852,317096,Aliens: Another Glorious Day in the Corps – 3D Gaming Set
256852,339425,Aliens: Another Glorious Day in the Corps – Alien Queen
256852,338510,Aliens: Another Glorious Day in the Corps – Alien Warriors
256852,344420,Aliens: Another Glorious Day in the Corps – Heroes of Hadley's Hope
256852,402006,Aliens: Another Glorious Day in the Corps – Marines APC
256852,344418,Aliens: Another Glorious Day in the Corps – Sulaco Survivors
256874,274249,Legendary Encounters: An Alien Deck Building Game – Encounters Organizer
256874,275562,Legendary Encounters: An Alien Deck Building Game – Encounters Organizer – Extra Dividers
256874,331833,Legendary Encounters: An Alien Deck Building Game – reDrewno Insert
256874,364905,Legendary Encounters: An Alien Deck Building Game – WarBox Insert
256874,348641,Legendary Encounters: The GiftForge Insert
256876,324716,Football Highlights 2052: Double Player Mat
256916,266248,Concordia: Folded Space Insert
256916,326369,Concordia: Folded Space Insert (Second edition)
256916,283515,Concordia: GeekUp Bag Set
256916,379054,Concordia: Moedas & Co. Metal Coins
256918,375286,Cerberus: Promotional stickers
256960,284305,Pax Pamir (Second Edition): Metal Coins & Cloth Bag
256960,305851,Pax Pamir (Second Edition): Ruler Tokens Upgrade Pack
256960,400373,Pax Pamir: Second Edition – e-Raptor Insert
256962,280238,TANKS: The Modern Age – British Dice Set
256964,326118,Dark Rituals: Malleus Maleficarum – 3D Token Pack
256964,326119,Dark Rituals: Malleus Maleficarum – Cauldron
256964,326117,Dark Rituals: Malleus Maleficarum – Marble dice set
256997,313811,"Perseverance: Castaway Chronicles – ""Squishy"" Berry Resources"
256997,313810,Perseverance: Castaway Chronicles – Dinosaur Miniatures
256997,313814,Perseverance: Castaway Chronicles – Language Pack
256997,313812,Perseverance: Castaway Chronicles – Metal Tracker Tokens
256997,313813,Perseverance: Castaway Chronicles – Neoprene Dice Tray
256999,272955,Project: ELITE – Marble Action Dice Set
256999,272956,Project: ELITE – Marble Hit Dice Set
257001,323829,Munchkin Box of Holding: Feldherr Insert
257001,272938,Munchkin Dungeon: Colored Dice Pack
257001,272941,Munchkin Dungeon: Epic Dungeon Board
257001,272939,Munchkin Dungeon: Extra Dice Pack
257001,323828,Munchkin Dungeon: Feldherr Insert
257001,272940,Munchkin Dungeon: Villain Dice Pack
257001,336822,Munchkin: Level Counter Bookmark
257056,313969,Lovelace & Babbage: Scott Aldie Card
257089,271937,Big Trouble in Little China: The Game – Insert Here Insert
257145,299283,Teenage Mutant Ninja Turtles: City Fall – Savage Slash Pack
257193,306009,Starcadia Quest: Crew Dice Bundle
257193,306008,Starcadia Quest: Plastic Token Pack
257193,306007,Starcadia Quest: Scenery Pack
257283,341342,Tiny Epic Game Haul Carrier
257283,283450,Tiny Epic Mechs: Playmat
257283,343458,Tiny Epic Mechs: Shipshape Gamer Organizer
257321,266614,Gen7: A Crossroads Game – Playmat
257499,274021,Arkham Horror (Third Edition): BGHQ Insert
257499,335490,Arkham Horror (Third Edition): Deluxe Rulebook
257499,308973,Arkham Horror (Third Edition): e-Raptor Insert
257499,308980,Arkham Horror (Third Edition): e-Raptor Organizer
257499,331504,Arkham Horror (Third Edition): Extended-Art Investigator Card Packs
257499,326396,Arkham Horror (Third Edition): Folded Space Insert
257499,347409,Arkham Horror (Third Edition): Game Tamer organizer
257499,267736,Arkham Horror (Third Edition): Gamemat
257499,319433,Arkham Horror (Third Edition): Insert Here Insert
257499,367221,Arkham Horror (Third Edition): Laserox Organizer
257499,348629,Arkham Horror (Third Edition): The GiftForge Insert
257499,365908,Arkham Horror (Third Edition): Tower Rex Organizer
257499,365806,Arkham Horror (Third Edition): Tower Rex Playerboard
257499,309611,Eldritch Horror: e-Raptor Clues Tokens Set (20 pcs)
257499,309613,Eldritch Horror: e-Raptor Sanity Tokens Set 1 pt (20 pcs)
257499,309615,Eldritch Horror: e-Raptor Sanity Tokens Set 3 pt (15 pcs)
257499,309616,Eldritch Horror: e-Raptor Stamina Tokens Set 1 pt (20 pcs)
257499,309617,Eldritch Horror: e-Raptor Stamina Tokens Set 3 pt (15 pcs)
257499,366323,Eldritch Horror: Investigators of Arkham – Momo Monster Multi-Use Playmat
257501,330530,KeyForge: Call of the Archons – Alternate Tokens
257501,268402,KeyForge: Call of the Archons – Architect's Vault Two-Player Gamemat
257501,330012,KeyForge: Call of the Archons – Chain Tracker Alternate Art Card
257501,330527,KeyForge: Call of the Archons – Chain Tracker Dial
257501,330523,KeyForge: Call of the Archons – Deck Box
257501,276977,KeyForge: Call of the Archons – Forged Keys
257501,332923,KeyForge: Call of the Archons – Forged Keys Cards
257501,272011,KeyForge: Call of the Archons – Insert Here Insert
257501,330009,KeyForge: Call of the Archons – Playmat
257501,330013,KeyForge: Call of the Archons – Power Tokens
257501,330014,KeyForge: Call of the Archons – Sleeves
257501,367330,KeyForge: Premium Chain Tracker
257501,364619,Keyforge: Premium Deck Book
257501,364775,Keyforge: Vault Deck Box
257518,306153,Claustrophobia 1643: Laserox Organizer
257614,315258,Tussie Mussie: Scoresheet
257668,265134,1906 San Francisco: 3D Rubble replacement
257700,297084,"Munchkin Warhammer 40,000 Kill-O-Meter"
257732,335007,Pax Porfiriana/Pax Transhumanity: Folding Board
257759,343465,The River: Shipshape Gamer Insert
257987,279133,The Towers of Arkhanos: Playmat
258148,357419,Power Rangers: Heroes of the Grid –  Helmeted S.P.D. Shadow Ranger Promo
258148,340544,Power Rangers: Heroes of the Grid – Card Storage Box
258148,391900,Power Rangers: Heroes of the Grid – Card Storage Box 2
258148,274097,Power Rangers: Heroes of the Grid – Foot Soldier Pack
258148,352686,Power Rangers: Heroes of the Grid – Green Samurai Ranger Super Samurai Mode Promo
258148,274098,Power Rangers: Heroes of the Grid – Megazord Deluxe Figure
258148,374558,Power Rangers: Heroes of the Grid – Power Board & Panic Token Upgrade
258148,374556,Power Rangers: Heroes of the Grid – Psycho Silver Ranger Promo
258148,274096,Power Rangers: Heroes of the Grid – Ranger Dice Set
258148,348994,Power Rangers: Heroes of the Grid – Ranger Dice Set #2
258148,369018,Power Rangers: Zordon Dice Tower
258210,341262,Blitzkrieg!: Alternate Art Bag for Axis Player
258242,354963,Magnate: The First City – KS Note
258295,397859,Ascendancy: Deluxe Components Bundle
258295,397858,Ascendancy: Premium Miniatures Bundle
258653,378535,Cry Havoc: The Wood
258779,366720,Planet Unknown: Neoprene Playmat
258779,404482,Planet Unknown: Upgrade Pack
259061,377698,Skytear: Hero Poker Chips
259298,330563,The Ancient World (Second Edition): Metal Coins
259435,270219,Middle-earth Strategy Battle Game: General's Accessories Pack
259857,343447,Jurassic Parts: Shipshape Gamer Insert
260143,310655,Adventures in Neverland: Miniatures Set
260143,310656,Adventures in Neverland: Oversized Gaming Mat
260147,308023,Europe Divided: EuRubel Metal Coins Set
260147,308024,Europe Divided: Wooden Dice and Meeples Set
260170,283617,Shake Up: Playmat
260180,328123,Project L: Master Box
260180,406297,Project L: Playmat set
260234,270219,Middle-earth Strategy Battle Game: General's Accessories Pack
260383,264463,Surfer's Spiel'18 Promotion tile
260428,333624,Pandemic: Iberia – Folded Space Insert
260524,377050,Beyond Humanity: Colonies – Game Mat
260645,368763,"1565, St. Elmo's Pay: Playmat"
260678,331543,Stone Age: Folded Space Insert
260785,288904,Unstable Unicorns: Collector's Box
260785,246085,Unstable Unicorns: Playmat
260785,400264,Unstable Unicorns: Rainbow Apocalypse Vinyl Mini Series Adorable Flying Unicorn Exclusive Foil
260785,400256,Unstable Unicorns: Rainbow Apocalypse Vinyl Mini Series Cotton Candy Llamacorn Exclusive Foil
260785,400263,Unstable Unicorns: Rainbow Apocalypse Vinyl Mini Series Glitter Unicorn Exclusive Foil
260785,400262,Unstable Unicorns: Rainbow Apocalypse Vinyl Mini Series Innocent Bunnicorn Exclusive Foil
260785,400261,Unstable Unicorns: Rainbow Apocalypse Vinyl Mini Series Unicorn of Death Exclusive Foil
260785,400257,Unstable Unicorns: Rainbow Apocalypse Vinyl Mini Series Unicorn of Famine Exclusive Foil
260785,400259,Unstable Unicorns: Rainbow Apocalypse Vinyl Mini Series Unicorn of Pestilence Exclusive Foil
260785,400258,Unstable Unicorns: Rainbow Apocalypse Vinyl Mini Series Unicorn of War Exclusive Foil
260785,369247,Unstable Unicorns: Vinyl Mini Series Annoying Flying Unicorn Exclusive Foil
260785,369248,Unstable Unicorns: Vinyl Mini Series Classy Narwhal Exclusive Foil
260785,369249,Unstable Unicorns: Vinyl Mini Series Dark Angel Unicorn Exclusive Foil
260785,369250,Unstable Unicorns: Vinyl Mini Series Ginormous Unicorn Exclusive Foil
260785,369251,Unstable Unicorns: Vinyl Mini Series Magical Kittencorn Exclusive Foil
260785,369254,Unstable Unicorns: Vinyl Mini Series Necromancer Unicorn Exclusive Foil
260785,369252,Unstable Unicorns: Vinyl Mini Series Queen Bee Unicorn Exclusive Foil
260785,369253,Unstable Unicorns: Vinyl Mini Series Stabby The Unicorn Exclusive Foil
260786,288904,Unstable Unicorns: Collector's Box
260786,246085,Unstable Unicorns: Playmat
260786,400264,Unstable Unicorns: Rainbow Apocalypse Vinyl Mini Series Adorable Flying Unicorn Exclusive Foil
260786,400256,Unstable Unicorns: Rainbow Apocalypse Vinyl Mini Series Cotton Candy Llamacorn Exclusive Foil
260786,400263,Unstable Unicorns: Rainbow Apocalypse Vinyl Mini Series Glitter Unicorn Exclusive Foil
260786,400262,Unstable Unicorns: Rainbow Apocalypse Vinyl Mini Series Innocent Bunnicorn Exclusive Foil
260786,400261,Unstable Unicorns: Rainbow Apocalypse Vinyl Mini Series Unicorn of Death Exclusive Foil
260786,400257,Unstable Unicorns: Rainbow Apocalypse Vinyl Mini Series Unicorn of Famine Exclusive Foil
260786,400259,Unstable Unicorns: Rainbow Apocalypse Vinyl Mini Series Unicorn of Pestilence Exclusive Foil
260786,400258,Unstable Unicorns: Rainbow Apocalypse Vinyl Mini Series Unicorn of War Exclusive Foil
260786,369247,Unstable Unicorns: Vinyl Mini Series Annoying Flying Unicorn Exclusive Foil
260786,369248,Unstable Unicorns: Vinyl Mini Series Classy Narwhal Exclusive Foil
260786,369249,Unstable Unicorns: Vinyl Mini Series Dark Angel Unicorn Exclusive Foil
260786,369250,Unstable Unicorns: Vinyl Mini Series Ginormous Unicorn Exclusive Foil
260786,369251,Unstable Unicorns: Vinyl Mini Series Magical Kittencorn Exclusive Foil
260786,369254,Unstable Unicorns: Vinyl Mini Series Necromancer Unicorn Exclusive Foil
260786,369252,Unstable Unicorns: Vinyl Mini Series Queen Bee Unicorn Exclusive Foil
260786,369253,Unstable Unicorns: Vinyl Mini Series Stabby The Unicorn Exclusive Foil
260789,347499,Assassin's Creed: Brotherhood of Venice – Crow's Nest
260789,347495,Assassin's Creed: Brotherhood of Venice – Deluxe Assassin Dice Set
260789,265287,Assassin's Creed: Brotherhood of Venice – Ezio the Assassin
260789,376654,Assassin's Creed: Brotherhood of Venice – Language Pack
260789,351268,Assassin's Creed: Brotherhood of Venice – Tower
261329,295080,Schatten der Macht: Stoffkarte
261393,339777,Dungeon Universalis: Coins
261393,339778,Dungeon Universalis: Dice
261393,371092,Dungeon Universalis: Dice Set
261393,339776,Dungeon Universalis: Miniatures of DUN
261393,371035,Dungeon Universalis: Playmats
261393,371034,Dungeon Universalis: Standees Bestiary Box I
261393,371040,Dungeon Universalis: Standees Bestiary Box II
261393,339780,Dungeon Universalis: Standees-Pawns
