game_id,id,value
293014,365301,Nidavellir: Trésor Royal Deluxe
293141,330990,King of Tokyo/King of New York: Dark Cyber Kitty (promo character)
293141,317137,King of Tokyo/King of New York: Dark Space Penguin (promo character)
293141,368945,King of Tokyo/King of New York: Steel Armored Qilin (promo character)
293264,365747,Monsters on Board: Plastic Fearmobiles
293267,339829,Kitara: New Heroes
293474,371492,Wolfenstein: 3D Terrain Kit
293495,351682,StoneFire: Game Mat
293671,318658,Necromunda: Underhive – Corpse Grinder Gang Dice
293679,327929,Escape from the Titanic: Patriot Castaway Expansion
293889,293932,Fallout Shelter: Game Mat
293925,322784,2GM Pacific: Game Mat
294263,402609,EOS: Neoprene Game Map
294378,314898,Divinity Original Sin: The Board Game – Dice Set
294378,314889,Divinity Original Sin: The Board Game – Metal Coin Set
294448,410721,Tea for 2: First Player Metal Token
294484,368268,Unmatched Alternate Art Promo Card Pack
294484,368266,Unmatched Sleeves
294484,406107,Unmatched: Acrylic Sidekicks Pack 2
294484,373080,Unmatched: Battle Box
294484,373079,Unmatched: Boost Cube
294484,373082,Unmatched: Brawl Bag
294484,363924,Unmatched: Cobble & Fog – Foil Cards
294484,368063,Unmatched: Contest Coin
294484,373081,Unmatched: Go Bag
294484,368065,Unmatched: Neoprene Battle Mats
294612,329849,Unlock: GameGuard Organizer
294623,404061,Knight Tales: 50 Golden Metal Coins
294623,404062,Knight Tales: Marble Dice Set
294623,404060,Knight Tales: Neoprene Playmat
294710,349393,Outrun: Neoprene Mat
295072,376862,Downfall of Empires: Playmat
295159,411222,GMT Games Errata Counters 2023
295195,346905,Clash of Armies: Medieval – Tapetes
295260,337383,It's a Wonderful World: GeekUp Bit Set
295260,299221,It's A Wonderful World: Printed Wooden Turn Track
295262,363653,Sniper Elite: Deluxe Upgrade Kit
295293,356045,The Thing: Alien Miniatures Set
295293,356040,The Thing: Human Miniatures Set
295293,356052,The Thing: Norwegian Miniatures Set
295293,360754,The Thing: Playmat
295293,360753,The Thing: Special Weather Dice
295293,360751,The Thing: Tokens Set 1
295293,360752,The Thing: Tokens Set 2
295486,367087,KOSMOS Helper App
295535,346729,Dark Ages: Gold Tokens
295535,346733,Dark Ages: Heritage of Charlemagne/Holy Roman Empire – Great Domain Neoprene Mat
295535,346732,Dark Ages: Ressource Cache
295564,368268,Unmatched Alternate Art Promo Card Pack
295564,368266,Unmatched Sleeves
295564,406106,Unmatched: Acrylic Sidekicks Pack 1
295564,406107,Unmatched: Acrylic Sidekicks Pack 2
295564,406105,Unmatched: Acrylic Sidekicks Pack 3
295564,373080,Unmatched: Battle Box
295564,373079,Unmatched: Boost Cube
295564,373082,Unmatched: Brawl Bag
295564,368063,Unmatched: Contest Coin
295564,373081,Unmatched: Go Bag
295564,368065,Unmatched: Neoprene Battle Mats
295770,383044,Frosthaven: Challenge Coin
295770,372405,Frosthaven: Folded Space Insert
295770,372406,Frosthaven: Folded Space Map Archive
295770,381644,Frosthaven: Laserox Organizer
295770,392907,Frosthaven: Smonex Organizer
295770,391907,Frosthaven: The GiftForge Insert
295770,391908,Frosthaven: The GiftForge Map Frame
295770,282059,Gloomhaven: Crafting Kingdoms Playmats
295770,365831,Gloomhaven: Tower Rex Character Dashboard
295785,340224,Euthia: Torment of Resurrection – Add-on pack
295785,340221,Euthia: Torment of Resurrection – Custom Dice
295785,367918,Euthia: Torment of Resurrection – Dragonslayer Towers
295785,340220,Euthia: Torment of Resurrection – Metal Coins
295785,340219,Euthia: Torment of Resurrection – Organizer
295785,370176,Euthia: Torment of Resurrection – Printed Dwurt Die
295785,355757,Euthia: Torment of Resurrection – The GiftForge Card and map tile holders
295785,355756,Euthia: Torment of Resurrection – The GiftForge Insert
295785,355761,Euthia: Torment of Resurrection – The GiftForge Other components holders
295785,355760,Euthia: Torment of Resurrection – The GiftForge Tile holders
295785,355758,Euthia: Torment of Resurrection – The GiftForge Token holders
295785,370175,Euthia: Torment of Resurrection – Trade & Scenario Board
295895,348938,Distilled: Metal Coins
295895,381759,Distilled: Metal First Player Token
295895,348937,Distilled: Metal Recipe Cubes
295895,348936,Distilled: Premium Market Playmat
295944,367087,KOSMOS Helper App
295945,367087,KOSMOS Helper App
295947,376350,Cascadia: Eurohell Design pinecones
295947,368484,Cascadia: Meeple Source Pine Cone Upgrade
295947,380650,Cascadia: Riverside Woodshop Game Grids
295947,374523,Cascadia: Sloyca Insert
295947,378763,Cascadia: Spielmaterial.de Upgrade
295947,365780,Cascadia: Tower Rex Organizer
295948,350199,Aqualin: GeekUp Bag
295949,367087,KOSMOS Helper App
296100,321819,Rococo: Deluxe Edition – Metal Livre Coins
296108,405898,Terraforming Mars: The Dice Game – GeekyGameyGadgets Insert/Organizer
296108,400304,Terraforming Mars: The Dice Game – Neoprene Game Boards
296108,400305,Terraforming Mars: The Dice Game – Neoprene Game Boards for TM 3D Tiles
296151,381082,Viscounts of the West Kingdom Collector's Box: Folded Space Insert
296151,325277,Viscounts of the West Kingdom: Folded Space Insert
296151,376751,Viscounts of the West Kingdom: GolonkoCrafts Inkwells
296151,334818,Viscounts of the West Kingdom: Laserox Organizer
296151,348548,Viscounts of the West Kingdom: The GiftForge Insert
296151,365810,Viscounts of the West Kingdom: Tower Rex Organizer
296151,264865,West Kingdom: Metal Coins
296237,357009,Warp's Edge: Anomaly – Token Upgrade Pack
296237,322452,Warp's Edge: Playmat
296237,322450,Warp's Edge: Token Upgrade Pack
296238,369294,Sea of Legends: Bob Kehl Captain Set
296238,311051,Sea of Legends: Metal Coins
296238,369292,Sea of Legends: Metal Notoriety
296238,311050,Sea of Legends: Neoprene Mat
296238,407023,Sea of Legends: Translucent Sea Coven Miniatures
296238,369422,Sea of Legends: Update Kit
296694,348278,BattleTech: Battlefield Support Deck
296694,351241,BattleTech: Field Report – AFFS
296694,351243,BattleTech: Field Report – CCAF
296694,351274,BattleTech: Field Report – DCMS
296694,351275,BattleTech: Field Report – FWLM
296694,351276,BattleTech: Field Report – LAAF
296694,351277,BattleTech: Field Report – Periphery
296694,351242,BattleTech: Field Report – The Clans
296694,349705,BattleTech: Legends
296694,360389,BattleTech: Record Sheets – 3050 Upgrades Unabridged – Clan & Star League
296694,360385,BattleTech: Record Sheets – 3050 Upgrades Unabridged – Inner Sphere
296694,350837,BattleTech: Record Sheets – Clan Invasion
296694,350980,BattleTech: Record Sheets – Succession Wars
296694,352163,BattleTech: Record Sheets – Vehicle Annex: IndustrialMechs & Exoskeletons
296694,350831,BattleTech: Reinforcements – Die-Cut Pack #1
296694,350832,BattleTech: Reinforcements – Die-Cut Pack #2
296694,350833,BattleTech: Reinforcements – Record Sheets Book #1
296694,350835,BattleTech: Reinforcements – Record Sheets Book #2
296694,379310,Battletech: Urbanmech Company
297030,342238,"Tekhenu: Eurohell Design ""Obelisk"" 3D resources"
297030,349833,Tekhenu: GolonkoCrafts Deluxe Resources
297030,323220,Tekhenu: Obelisk of the Sun – Folded Space Insert
297030,400988,Tekhenu: Obelisk of the Sun – GeekUp Bit Set
297443,297444,King of Kings: quick reference guide
297562,313483,Kemet: Blood and Sand – Bags
297562,313478,Kemet: Blood and Sand – Playmat
297562,313486,Kemet: Blood and Sand – Sleeves Pack
297562,313476,Kemet: Blood and Sand – The Great Old Ones
297562,313482,Kemet: Blood and Sand – Tiles Displays
297562,185103,Kemet: Storage Bags
297674,349181,Pacific Rails Inc.: 80 deluxe tokens
297674,343449,"Pacific Rails, Inc.: Shipshape Gamer Insert"
297978,319371,Mariposas: Purple Butterflies Promo Pack
298047,313445,Marvel United: Classic Cardboard Locations
298047,343748,Marvel United: Classic Cardboard Villain Dashboards
298047,398995,Marvel United: Folded Space Insert
298047,386873,Marvel United: Multiverse – Playmat
298047,339567,Marvel United: Plastic Tokens
298047,313444,Marvel United: Playmat
298047,401535,Marvel United: Playmaty rubber mat
298047,339566,Marvel United: X-Men Playmat
298069,350031,Cubitos: GameMaker3D Dice Containers
298069,403665,Cubitos: GeekUp Bit Set – Metal Coins
298069,355121,Cubitos: GeekyGameyGadgets Insert/Organizer
298102,370791,Roll Camera!: Metal Dice
298102,370335,Roll Camera!: The B-Movie Expansion – Wooden Tokens
298163,377442,Dark Venture: Battle of the Ancients – Premium Wood Unit Tokens
298231,365123,Skyrise: Wooden Token Pack
298371,359072,Wild Space: LevityGames Meeple Upgrade Kit
298371,386367,Wild Space: Upgraded Space Ships
298378,340965,Maharaja: Printed Fabric Player Bags
298383,361205,Golem: reDrewno Insert
298383,369470,Golem: The Dicetroyers Organizer
298383,403144,Golem: Token Upgrade Kit
298459,382964,Stwory z Obory: Playmat
298572,316231,Cosmic Encounter Duel: Gamemat
298683,298747,Modern Armor: American Armor Cards
298683,298738,Modern Armor: Arab-Israeli Wars Armor Cards
298683,298749,Modern Armor: Asian Armor Cards
298683,298748,Modern Armor: British Armor Cards
298683,298746,Modern Armor: European Armor Cards
298683,298750,Modern Armor: French Armor Cards
298683,298751,"Modern Armor: Soviet, Russian, and Ukrainian Armor Cards"
298683,298753,Modern Armor: West German and German Armor Cards
298684,298754,The Armored Fist: American Armor Cards
298684,298755,"The Armored Fist: Armor Cards, France 1940"
298684,298758,The Armored Fist: British Armor Cards
298684,298756,The Armored Fist: German Armor Cards
298684,298757,The Armored Fist: Soviet Armor Cards
299044,299437,Fear God & Dread Nought: 2nd Edition – Player's Handbook
299047,352306,Disney Villainous: LaserLand Cauldron & Power Token Upgrade
299047,352415,Disney Villainous: LaserLand Cruella De Vil Token Upgrade
299047,352298,Disney Villainous: LaserLand Evil Queen Token Upgrade
299047,352299,Disney Villainous: LaserLand Fate & Locks Token Upgrade
299047,352300,Disney Villainous: LaserLand Gaston Token Upgrade
299047,352307,Disney Villainous: LaserLand Lady Tremaine Token Upgrade
299047,352301,Disney Villainous: LaserLand Mother Gothel Token Upgrade
299047,352302,Disney Villainous: LaserLand Pete Token Upgrade
299047,352303,Disney Villainous: LaserLand Prince John Token Upgrade
299047,352305,Disney Villainous: LaserLand Scar Strength Tracker Upgrade
299047,352416,Disney Villainous: LaserLand Special Movers Token Upgrade
299047,352417,Disney Villainous: LaserLand Strength Token Upgrade
299047,352304,Disney Villainous: LaserLand Villain Randomizer
299105,328915,Black Swan: UberTex Map
299121,328891,Machina Arcana: Card Update Pack
299121,328618,Machina Arcana: Core Dice
299121,328617,Machina Arcana: Game Mats
299121,360926,Machina Arcana: Ultimate Sleeve Set
299122,328891,Machina Arcana: Card Update Pack
299122,328618,Machina Arcana: Core Dice
299122,328617,Machina Arcana: Game Mats
299178,342408,Small Railroad Empires: Custom Wooden Tracks
299178,395257,Small Railroad Empires: Playmat
299178,399369,Small Railroad Empires: Upgrade Pack
299249,321816,Mint Control: Playmat
299252,369123,Here to Slay: 6-Class Meeple Set
299252,368972,Here to Slay: Agile Dagger Vinyl Exclusive Foil
299252,369244,Here to Slay: Berserkers & Necromancers Meeples
299252,369040,Here to Slay: Central Play Mat
299252,368973,Here to Slay: Doe Fallow Vinyl Exclusive Foil
299252,369124,Here to Slay: Dragon Class Meeple Set
299252,369042,Here to Slay: Expansion Play Mat 2-pack
299252,368967,Here to Slay: Guiding Light Vinyl Exclusive Foil
299252,368971,Here to Slay: Hopper Vinyl Exclusive Foil
299252,369501,Here to Slay: Kickstarter Exclusive Acrylic Standees
299252,368976,Here to Slay: Kickstarter Exclusive Play Mat Box Set
299252,368969,Here to Slay: Lookie Rookie Vinyl Exclusive Foil
299252,368965,Here to Slay: Mellow Dee Vinyl Exclusive Foil
299252,368964,Here to Slay: Pan Chucks Vinyl Exclusive Foil
299252,369041,Here to Slay: Play Mat
299252,368970,Here to Slay: Shurikitty Vinyl Exclusive Foil
299252,369125,Here to Slay: Warrior & Druids Meeples
299252,376589,Here to Sleigh: Play Mat
299317,303794,Aeon's End: Accessory Pack 3
299317,321265,Aeon's End: Outcasts – Neoprene Play Mat
299372,356643,Succulent: TidyGamer Insert
299450,309226,Tsukuyumi: Full Moon Down (Second Edition) – Alternate Sculpt Oni
299450,353845,Tsukuyumi: Full Moon Down Playmat
299452,327830,Dale of Merchants: Playmat bag
299684,349392,Khôra: Rise of an Empire – Metal Coins
299702,367781,The Lost Code: Playmat
299702,367782,The Lost Code: Upgrade Kit
299733,340594,Sanctuary: The Keepers Era – Champions & Villains foil cards
299733,359531,Sanctuary: The Keepers Era – Champions of Elnerth Foil Cards
299733,340337,Sanctuary: The Keepers Era – Keepers Sleeves
299733,340335,Sanctuary: The Keepers Era – Playmats
299963,353284,Der Perfekte Moment: Die Taschendieb Erweiterung – Das Deluxe Material
299963,322780,Picture Perfect: Deluxe Acrylic Upgrade Pack
299963,379498,Picture Perfect: The Movie Star Expansion – Deluxe Acrylic Upgrade Pack
299963,379499,Picture Perfect: The Sherlock Expansion – Deluxe Acrylic Upgrade Pack
300001,341260,Renature: Stickers
300081,332084,Hideous Abomination: Playmat
300217,316668,Merchants of the Dark Road: Lumi Metal Coins
300217,339909,Merchants of the Dark Road: Merchant Coin Pouches
300217,377269,Merchants of the Dark Road: Player Wagon Upgrade
300217,366386,Merchants of the Dark Road: The GiftForge Insert
300300,355956,Chronicles of Crime: 1400 – Wooden Dog Meeple
300300,313297,Chronicles of Crime: The Millennium Series – Neoprene Mat
300300,307037,Chronicles of Crime: The Millennium Series Collector's Box
300300,265981,Chronicles of Crime: The Virtual Reality Module
300322,336554,Hallertau: Folded Space Insert
300322,355547,Hallertau: GeekyGameyGadgets Insert/Organizer
300322,344502,Hallertau: Laserox Organizer
300322,365786,Hallertau: Tower Rex Organizer
300521,340087,Rush Out!: Dice Trays
300531,341413,Paleo: BGExpansions Upgrade Kit
300531,375803,Paleo: Eurohell Design 3D Skulls & Hearts
300531,368404,Paleo: Feldherr Organizer
300531,367224,Paleo: Laserox Organizer
300531,368407,Paleo: LevityGames Meeple Sticker Upgrade Kit
300751,353221,Mini Express: Great Britain 1918
300751,336100,Mini Express: US & Europe Playmats
300751,331195,Mini Express: Wooden Insert
300877,366916,New York Zoo: MeeplesUpgrade Upgrade Kit Stickers
300877,321658,New York Zoo: Painted Promo-Elephant
301257,367991,Maglev Metro: Replacement Copper Robots
301480,394549,Binho Balls
301607,367330,KeyForge: Premium Chain Tracker
301607,364619,Keyforge: Premium Deck Book
301607,364775,Keyforge: Vault Deck Box
301728,341551,Endogenesis: Player Mat
301767,324929,Mysterium Park: The Halloween Libellud Show Promo Cards
301880,320586,Raider of Scythia: Meeple Realty Insert
301880,326476,Raiders of Scythia: Folded Space Insert
301880,312894,Raiders of Scythia: Metal Coins
301880,347544,Raiders of Scythia: reDrewno Insert
301880,348648,Raiders of Scythia: The GiftForge Insert
302098,313297,Chronicles of Crime: The Millennium Series – Neoprene Mat
302098,307037,Chronicles of Crime: The Millennium Series Collector's Box
302098,265981,Chronicles of Crime: The Virtual Reality Module
302312,313297,Chronicles of Crime: The Millennium Series – Neoprene Mat
302312,307037,Chronicles of Crime: The Millennium Series Collector's Box
302312,265981,Chronicles of Crime: The Virtual Reality Module
302413,359396,Steamwatchers: Neoprene Mat
302413,349775,Steamwatchers: Neoprene Stitched Playmat
302421,382541,Solo Fluxx Playmat
302679,351381,Stormsunder: Dice Pack
302679,351379,"Stormsunder: Elise, the Lost Princess"
302679,351380,"Stormsunder: Faeyra, the Last Titan"
302679,351378,Stormsunder: Heirs of Ruin 3D Terrain Pack
302679,351375,Stormsunder: Villains and Civilians I
302679,351376,Stormsunder: Villains and Civilians II
302679,351377,Stormsunder: Villains and Civilians III
302723,312883,Forgotten Waters: Card and Counter Organizer
302755,349382,Stop the Train!: The Silver Flame Train Counter
302911,353071,Mein Königreich für ein Pferd: Deluxe Spielertabelau
302917,412076,King of 12: 4 XXL blue dices
303553,397256,Button Shy Game Haul Bag
303553,322631,Skulls of Sedlec: Scoring Card
303672,325907,Trek 12: Guide de Survie du Trekkeur Confiné
303830,372833,Mass Transit: Meeple Stickers
303954,352037,Annual errata card pack 2021
303954,336161,Pax Viking: Metal Coins
304021,407520,The Lost Box
304051,358908,Creature Comforts: 10 Custom Dice
304051,368015,Creature Comforts: reDrewno Insert
304051,374061,Creature Comforts: Sloyca Insert
304051,358906,Creature Comforts: Wooden Bits Upgrade Pack
304051,398681,Útulná doupata: Kalkared Insert
304285,327785,Infinity Gauntlet: A Love Letter Game – Foil Infinity Stones Cards
304333,393301,Zoollywood: Miniature Pack
304420,410269,Bonfire + Expansion: e-Raptor Insert
304420,373007,Bonfire + Expansion: reDrewno Insert
304420,388984,Bonfire: e-Raptor acrylic tokens
304420,412734,Bonfire: Folded Space Insert
304420,360995,Bonfire: Meeple Source Resources
304420,337691,Bonfire: reDrewno Insert
304420,382565,Bonfire: Sloyca Insert
304510,401314,Pampero: Metal Coins
304620,329818,World of Tanks Miniatures Game: German Dice and Decals
304620,329562,World of Tanks Miniatures Game: Summer Game Mat – Prokhorovka
304620,329822,World of Tanks Miniatures Game: Tank Ace Dice and Decals
304620,354185,World of Tanks Miniatures Game: Tank Garage
304620,329821,World of Tanks Miniatures Game: U.K. Dice and Decals
304620,329819,World of Tanks Miniatures Game: U.S.A. Dice and Decals
304620,329820,World of Tanks Miniatures Game: U.S.S.R. Dice and Decals
304783,380369,Hadriánův val: Náhradní bločky
304937,371228,They Live: Assault On Cable 54 – Hoffman Lenses
304937,371221,They Live: Assault On Cable 54 – Kick Ass Bubble Gum Dice
304937,371222,They Live: Assault On Cable 54 – Stretch Edition Box
304985,346729,Dark Ages: Gold Tokens
304985,346733,Dark Ages: Heritage of Charlemagne/Holy Roman Empire – Great Domain Neoprene Mat
304985,346732,Dark Ages: Ressource Cache
305096,324757,Endless Winter: Paleoamericans – Big Box
305096,373526,Endless Winter: Paleoamericans – Deluxe Resin Components Upgrade Pack
305096,373525,Endless Winter: Paleoamericans – Playmat
305682,360255,Rolling Realms: 35mm Epic Dice (Pair of 2)
305752,314488,Gate: Game Mat
306040,372026,Merv: The Heart of the Silk Road – e-Raptor Organizer
306040,334813,Merv: The Heart of the Silk Road – Laserox Organizer
306040,365788,Merv: The Heart of the Silk Road – Tower Rex Organizer
306300,358940,Little Factory: Playmat
306637,341955,Resident Evil 3: The Board Game – Dice Pack
306637,341898,Resident Evil 3: The Board Game – Hunter Monster Box
306637,308647,Resident Evil 3: The Board Game – Retro Pack
306637,341897,Resident Evil 3: The Board Game – Terrain Pack
306650,374696,Prosperitea: Metal Coins
306697,400987,Smash Up: GeekUp Bit Set
306735,389233,Under Falling Skies: Cinder & Ember Organizer
306881,405689,Railroad Ink: Additional Players Pack
306881,407458,Railroad Ink: Embroidered Cloth Bag Pack
306881,340005,Railroad Ink: Giant Box
306882,405689,Railroad Ink: Additional Players Pack
306882,407458,Railroad Ink: Embroidered Cloth Bag Pack
306882,340005,Railroad Ink: Giant Box
307044,372870,Trailblazer: The John Muir Trail – Playmat
307044,372871,Trailblazer: The John Muir Trail – Upgraded First Player Marker
307305,366718,Bullet: Deluxe Bullets
307386,322603,Set a Watch: Swords of the Coin – Cloth Play Mat
307386,322604,Set a Watch: Swords of the Coin – Metal Coins & Cloth Pouch
307715,350149,High Noon: 3D Chips & Gold Upgrade Pack
307715,350150,High Noon: Minis Crate
307715,350148,High Noon: Starter Set Card Boxes
307970,308047,Creative Humans: Expansion Pack
308119,336159,Pax Renaissance: 2nd Edition – Metal Coins
308354,343444,Open Ocean: Shipshape Gamer Insert
308621,348856,Twisted Fables: Alice Playmat
308621,370151,Twisted Fables: Fable Miniatures Box 1
308621,370153,Twisted Fables: Fable Miniatures Box 2
308621,348854,Twisted Fables: Mermaid Playmat
308621,348855,Twisted Fables: Red Playmat
308621,370150,Twisted Fables: Sleeping Beauty Playmat
308621,374362,Twisted Fables: Sloyca Insert
308621,370698,Twisted Fables: WarBox Insert
308762,337693,Mystic Vale: reDrewno Insert
308765,366165,Praga Caput Regni: Eurohell Design Insert
308765,334128,Praga Caput Regni: Folded Space Insert
308765,334815,Praga Caput Regni: Laserox Organizer
308765,353802,Praga Caput Regni: reDrewno Insert
308765,373840,Praga Caput Regni: Spike Craft Insert
308765,365796,Praga Caput Regni: Tower Rex Organizer
308970,374992,A Touch of Evil: Plastic Resolve Tokens Set
308989,401592,The Index of Dark Cities
309110,397256,Button Shy Game Haul Bag
309110,367060,Food Chain Island: Expansion Collection – Wallet
309319,406653,Apogée: Playmat
309427,405101,Total Domination: Miniatures Set
309427,405100,Total Domination: Playmat
309430,341342,Tiny Epic Game Haul Carrier
309430,312607,Tiny Epic Pirates: Game Playmat
309430,312609,Tiny Epic Pirates: Metal Coins
309430,312608,Tiny Epic Pirates: Player Playmat
309430,343452,Tiny Epic Pirates: Shipshape Gamer Insert
309430,312610,Tiny Epic Pirates: Skull Dice
309630,320422,Small World of Warcraft: Colored Faction Dice
309630,401534,Small World of Warcraft: Playmaty rubber mat
309665,335014,Pizza Delivery: Playmats
309698,408192,Roar and Write!: Erasable Boards
309832,322239,Universal Rule: Credit Trackers
309913,411222,GMT Games Errata Counters 2023
310100,380592,Nemesis: BGExpansions Ammo Tokens
310100,407919,Nemesis: Constructs Pack
310100,408471,Nemesis: Lockdown – Acrylic Pack
310100,378710,Nemesis: Lockdown – Folded Space Insert
310100,321701,Nemesis: Lockdown – Kings
310100,367213,Nemesis: Lockdown – Laserox Organizer
310100,314926,Nemesis: Lockdown – Playmat
310100,321700,Nemesis: Lockdown – Spacecats
310100,369547,Nemesis: Lockdown – The Dicetroyers Organizer
310192,318456,Overboss: A Boss Monster Adventure – Market Board
310192,318457,Overboss: A Boss Monster Adventure – Tile Tower
310203,312607,Tiny Epic Pirates: Game Playmat
310203,312609,Tiny Epic Pirates: Metal Coins
310203,312608,Tiny Epic Pirates: Player Playmat
310203,343452,Tiny Epic Pirates: Shipshape Gamer Insert
310203,312610,Tiny Epic Pirates: Skull Dice
310371,376906,Kleos: Manticore Meeples
310632,395904,Dice Miner Plastic Mountain
310641,338658,Ostium: First Player Coin
310641,334900,Ostium: Playmats
310789,371107,Catapult Feud: Architect's Pack
310789,371109,Catapult Feud: Barricades
310789,371108,Catapult Feud: Terrain Mat
310789,339470,Catapult Kingdoms: Extra Ammunition Ammo Pack
310789,339472,Catapult Kingdoms: Neoprene Game Mat
310789,339471,Catapult Kingdoms: Pack Of Bricks Building Pack
310873,333777,Carnegie: Deluxe Metal Goods Cubes
310885,374753,Belaad: The Land of Swords and Quills – Ibn Haytham (Alhazen) Alternate Art Promo Card
311020,319922,Marvel Battleworld: Series 1 Travel Portal – Gold Ultron
311020,359306,Marvel Battleworld: Series 2 Premium Game Pieces Pack – Spider-Island Groot
311020,359307,Marvel Battleworld: Series 2 Storage Case – Pork Grind
311192,362383,Farts & Fairies Playmat
311193,349937,Anno 1800: Eurohell Design Insert
311475,348826,Masters of the Universe: The Board Game – 3D Pack Nature Set
311475,348825,Masters of the Universe: The Board Game – 3D Pack Rocks Set
311475,348827,Masters of the Universe: The Board Game – 3D Pack Ruins Set
311475,348802,Masters of the Universe: The Board Game – Battlefield Playmat
311475,385718,Masters of the Universe: The Board Game – Faker
311475,385716,Masters of the Universe: The Board Game – Kowl
311475,385717,Masters of the Universe: The Board Game – Mantisaur
311475,348801,Masters of the Universe: The Board Game – Marble Dice
311475,349256,Masters of the Universe: The Board Game – Plastic Castle Grayskull Pack
311541,367093,Escape Room: The Game – Companion App
311610,385639,Blazon: Metal Animal Achievement Set
311715,313437,Mini Rogue: Cloth Bag
311715,345506,Mini Rogue: Dice Tray
311715,313438,Mini Rogue: Extra Dice
311715,311720,Mini Rogue: Glittering Treasure
311731,386901,Freedom Five: Hero FX Pack
311731,386905,Freedom Five: Heroic Dice Set
311731,386902,Freedom Five: Holo-Foil Promo Pack
311731,386903,Freedom Five: Player Mat
311731,386904,Freedom Five: Standees
311822,392425,Kinghill: Double Layered Player Board
311822,392424,Kinghill: Worker Upgrade Set
311823,346148,Nova Aetas Renaissance: Dice
311828,334650,Sherwood Bandits: Loot Bag
311988,322893,Frostpunk: The Board Game – Dreadnought Expansion
311988,400141,Frostpunk: The Board Game – Laserox Organizer
311988,322895,Frostpunk: The Board Game – Miniatures Expansion
311988,322890,Frostpunk: The Board Game – Playing Mat
311988,322891,Frostpunk: The Board Game – Resources Expansion
311988,383710,Frostpunk: The Board Game – The GiftForge Insert
311988,337188,Frostpunk: The Board Game – The Iceberg Box
311988,337190,Frostpunk: The Board Game – Timber City Expansion
311988,380608,Frostpunk: The Board Game – Tinkering Paws Insert
312059,365191,Zero Leader: Miniatures
312267,329849,Unlock: GameGuard Organizer
312318,354901,Century Golem All-In-One Board Game Insert
312318,339298,Century: Golem Edition – An Endless World: Playmat
312484,403238,Lost Ruins of Arnak + Expansions: The GiftForge Insert
