game_id,id,value
146508,211205,T.I.M.E Stories: Alternate character art pack
146508,303521,T.I.M.E Stories: BGExpansions Upgrade Kit (69 pcs)
146508,271775,T.I.M.E Stories: Tower Rex Organizer
146508,255479,T.I.M.E Stories: Transparent Set
146652,274249,Legendary Encounters: An Alien Deck Building Game – Encounters Organizer
146652,275562,Legendary Encounters: An Alien Deck Building Game – Encounters Organizer – Extra Dividers
146652,331833,Legendary Encounters: An Alien Deck Building Game – reDrewno Insert
146652,364905,Legendary Encounters: An Alien Deck Building Game – WarBox Insert
146652,348641,Legendary Encounters: The GiftForge Insert
146725,181123,Golem Arcana: Map Tiles 1
146725,170503,Golem Arcana: Map Tiles 2
146725,170509,Golem Arcana: Map Tiles 3 – Marshes of Kesh
146725,170500,Golem Arcana: TDI Stylus
146735,336822,Munchkin: Level Counter Bookmark
146784,162326,A Touch of Evil: Dark Gothic – Red Omen Die
146791,322280,Shadows of Brimstone Revised Core Sets Upgrade Kit
146791,301973,Shadows of Brimstone: Blank Cards
146791,207566,Shadows of Brimstone: Deluxe 3D Resin Six-Shooter Template
146791,216039,Shadows of Brimstone: Deluxe Dark Stone Set
146791,216166,Shadows of Brimstone: Grizzly Bear
146791,216137,Shadows of Brimstone: Kickstarter Custom Dice
146791,192980,Shadows of Brimstone: Resin 3D Depth Track
146791,285935,Shadows of Brimstone: Resin Bandida (Female Bandido)
146791,285936,Shadows of Brimstone: Resin Bandido #2
146791,285932,Shadows of Brimstone: Resin Crates and Barrels Terrain Set
146791,285937,Shadows of Brimstone: Resin Female Gunslinger
146791,285938,Shadows of Brimstone: Resin Female Indian Scout
146791,289079,Shadows of Brimstone: Resin Female Lawman
146791,285939,Shadows of Brimstone: Resin Female Rancher #2
146791,285940,Shadows of Brimstone: Resin Female U.S. Marshal
146791,285941,Shadows of Brimstone: Resin Male Gunslinger #2
146791,289078,Shadows of Brimstone: Resin Male Rancher
146791,351158,Shadows of Brimstone: Resin Master Samurai
146791,285942,Shadows of Brimstone: Resin Nun
146791,286525,Shadows of Brimstone: Resin Piano Player
146791,285943,Shadows of Brimstone: Resin Saloon Girl #2
146791,286528,Shadows of Brimstone: Resin Special Enemy 'Fast Draw' Jeb Scafford
146791,243124,Shadows of Brimstone: Resin Special Enemy Black Fang War Shaman
146791,285949,Shadows of Brimstone: Resin Special Enemy Hellfire Witch
146791,285950,Shadows of Brimstone: Resin Special Enemy Vampire Lord
146791,285951,"Shadows of Brimstone: Resin Special Enemy Wasteland Warmaster Celarrius Drakoth, Betrayer of the Empire"
146791,243125,Shadows of Brimstone: Resin Special Enemy Werewolf Pack Master
146791,285953,Shadows of Brimstone: Resin Special Wandering Samurai Ronin
146791,260558,Shadows of Brimstone: Resin Specialty Ally Dogs
146791,260556,Shadows of Brimstone: Resin Specialty Ally Indian Brave
146791,260555,Shadows of Brimstone: Resin Specialty Ally Loco
146791,260557,Shadows of Brimstone: Resin Specialty Ally Mutant Blacksmith
146791,289067,Shadows of Brimstone: Resin Veteran Gunslinger
146791,289072,Shadows of Brimstone: Resin Veteran Saloon Girl with Void Hammer
146791,285946,Shadows of Brimstone: Special Enemy Crimson Hand Inquisitor
146791,286530,Shadows of Brimstone: The Lost Marshals Miniature Set
146886,291010,La Granja: Insert Here Insert
146886,395585,La Granja: Player Board
146910,318049,Wildcatters: Upgraded Tanker Replacements
147020,167751,Star Realms: Battlecruiser Alternate Art Promo Card
147020,253634,Star Realms: Blob Carrier Alternate Art Promo Card
147020,181673,Star Realms: Blob Fighter Alternate Art Promo Card
147020,295289,Star Realms: Coalition Messenger Alternate Art Promo Card
147020,252676,Star Realms: Colony Wars – Aging Battleship Alternate Art Promo Card
147020,210915,Star Realms: Convoy Bot Alternate Art Promo Card
147020,191730,Star Realms: Cutter Alternate Art Promo Card
147020,326031,Star Realms: D10 Faction Spindown Dice
147020,164144,Star Realms: Embassy Yacht Alternate Art Promo Card
147020,250306,Star Realms: Federation Shuttle Alternate Art Promo Card
147020,207648,Star Realms: Frontier Ferry Alternate Art Promo Card
147020,313279,Star Realms: High Alert – Dividers
147020,207649,Star Realms: Lancer Alternate Art Promo Card
147020,367998,Star Realms: Life Counter
147020,176408,Star Realms: Mech World Alternate Art Promo Card
147020,202531,Star Realms: Patrol Cutter Alternate Art Promo Card
147020,168058,Star Realms: Playmats
147020,205978,Star Realms: Predator Alternate Art Promo Card
147020,222562,Star Realms: Score Cards
147020,313525,Star Realms: Sleeves
147020,250312,Star Realms: Stealth Tower Alternate Art Promo Card
147020,250305,Star Realms: Stellar Reef Alternate Art Promo Card
147020,250311,Star Realms: Swarmer Alternate Art Promo Card
147020,250308,Star Realms: The Hive Alternate Art Promo Card
147020,161133,Star Realms: War World Alternate Art Promo Card
147116,291013,The Witcher Adventure Game: Insert Here Insert
147144,155764,Whacky Roll: Magnet Pack
147151,174202,Concept: XL Playmat
147168,147406,Guerra de mitos: Marcador de jugador inicial
147253,330563,The Ancient World (Second Edition): Metal Coins
147253,330561,The Ancient World (Second Edition): Upgrade Pack
147363,172409,Yu-Gi-Oh! Dice Masters Playmat
147537,168607,Malifaux: Scheme & Strategy Deck
147716,225756,Mars Attacks: The Miniatures Game – Civilian Slaughter
147716,225755,Mars Attacks: The Miniatures Game – Deluxe Gaming Mat: Straight Road
147716,225754,Mars Attacks: The Miniatures Game – Deluxe Gaming Mat: T-Junction
147716,242498,Mars Attacks: The Miniatures Game – Masters of Science
147716,225758,Mars Attacks: The Miniatures Game – Scenery Upgrade Pack
147782,176847,Carcassonne: Stoffbeutel
147782,197502,"Carcassonne: Zähltafel ""Magneto"""
147949,361863,One Night Ultimate Werewolf: Card sleeves
147949,272843,One Night Ultimate Werewolf: One Night Collection Game Crate
147949,274772,One Night Ultimate Werewolf: One Night Collection Game Crate – Extra Dividers
147949,170113,One Night Ultimate Werewolf: Playmat
148204,320479,Pulp Alley: Burst Templates
148204,320493,Pulp Alley: Horror Deck
148204,320495,Pulp Alley: Leagues Roster Pack
148204,320489,Pulp Alley: Rewards Pack
148204,320484,Pulp Alley: Solo Deck
148204,320483,Pulp Alley: Starter Deck
148228,193709,Splendor: AsmOPlay Gold Tokens
148228,337015,Splendor: Chilong and Nuwa Promo Tiles
148228,292898,Splendor: Cities of Splendor – Dice Con 2019 City Promo Tile
148228,272512,Splendor: Cities of Splendor – Splendid Cities Organizer
148228,346473,Splendor: Daiji and the Duke of Zhou Promo Tiles
148228,309478,Splendor: e-Raptor Insert
148228,337016,Splendor: Fuxi and the Yan Emperor Promo Tiles
148228,321502,Splendor: Greater China Tournament Prize Coins
148228,365990,Splendor: Hou Yi and Ji Fa Promo Tiles
148228,365991,Splendor: Jiang Ziya and Di Xin of Shang Promo Tiles
148228,403081,Splendor: LaserLand Acrylic Gems
148228,306398,Splendor: Laserox Gemstone Organizer
148228,184966,Splendor: Playmat
148228,401530,Splendor: Playmaty rubber mat
148228,268394,Splendor: Quick-Start Insert
148228,281008,Splendor: Space Cow Promo
148228,272769,Splendor: Splendid Game Chest
148228,348653,Splendor: The GiftForge Insert
148228,273589,Splendor: Tower Rex Organizer
148228,185398,Splendor: Translucent Gem Tokens
148261,245329,SeaFall: Metal Coins
148319,291138,Tragedy Looper: Insert Here Insert
148575,187218,Marvel Dice Masters: Avengers vs. X-Men – Beast: Mutate #666 Alternate Art Promo
148575,187368,Marvel Dice Masters: Avengers vs. X-Men – Black Widow: Tsarina Alternate Art Promo
148575,271248,Marvel Dice Masters: Avengers vs. X-Men – Daedalus Productions Case
148575,223631,Marvel Dice Masters: Avengers vs. X-Men – Hulk: Green Goliath Alternate Art Promo Card
148575,171816,Marvel Dice Masters: Avengers vs. X-Men – Playmat
148575,187217,Marvel Dice Masters: Avengers vs. X-Men – Storm: African Priestess
148575,187228,Marvel Dice Masters: Avengers vs. X-Men – Storm: Wind-Rider Alternate Art Promo
148575,268350,Marvel Dice Masters: Deadpool Promo Card
148949,267351,Istanbul: Folded Space Insert
148949,325279,Istanbul: Folded Space Insert (Second edition)
148949,187888,Istanbul: Location Overlays
148949,338848,Istanbul: Moedas & Co. Metal Coins
148949,166590,"Istanbul: Promo fountain tile ""Sprudelhof"""
148949,268396,Istanbul: Quick-Start Insert
148949,365877,Istanbul: Tower Rex Organizer
148949,187887,Istanbul: Wheelbarrow Overlays
148951,341342,Tiny Epic Game Haul Carrier
148951,203607,Tiny Epic Kingdoms: Action / Tower Playmat
148951,181455,Tiny Epic Kingdoms: Complete Set of Character Meeples (112 pcs)
148951,272017,Tiny Epic Kingdoms: Kingdoms Chest
148951,181755,Tiny Epic Kingdoms: Sampler Set (16 pcs)
148951,343457,Tiny Epic Kingdoms: Shipshape Gamer Organizer
149097,171363,Spurs: Wood Bullets
149130,382541,Solo Fluxx Playmat
149155,359350,Dead Man's Draw: Pirate Token
149155,203802,Dead Man's Draw: Playmat
149169,176799,Heavy Steam: Brass and Copper Dice
149169,176798,Heavy Steam: Wooden Game Box
149241,377419,Assault on Doomrock: Second Edition Upgrade Pack
149776,260044,Fireteam Zero: Extra Dice
149776,218760,Fireteam Zero: Spawn Point Pack
149787,327488,Perdition's Mouth: Abyssal Rift – Basically Wooden Organizer
149787,287603,Perdition's Mouth: Abyssal Rift – Doors & Chests
149787,308172,Perdition's Mouth: Victim #3
149896,287106,Alien vs Predator: Second Edition Upgrade Kit
149951,308269,Warfighter Modern: 2019 Upgrade Kit
149951,396796,Warfighter: 2023 Update Kit
149951,358634,Warfighter: Battle Packs Wave 3 Card Dividers
149951,151388,Warfighter: Bullet Dice
149951,313752,Warfighter: Dice Pack
149951,170683,Warfighter: Metal Soldier Figures
149951,151805,Warfighter: Playmat
149951,151629,Warfighter: Second Counter Sheet
149951,293394,Warfighter: The Tactical Special Forces Card Game – #34 Daytime Card Dividers
150005,355076,Lock 'n Load Tactical: Companion Books
150005,277031,Lock 'n Load Tactical: Digital
150005,342404,Lock 'n Load Tactical: Heroes of Normandy – 4K X-Maps
150005,247826,Lock 'n Load Tactical: Heroes of Normandy – X-Maps
150005,285154,Lock 'N Load Tactical: Player Aids
150005,285155,Lock 'N Load Tactical: Quick Reference Flip Cards
150010,285710,Tiger Leader: Miniatures Pack
150010,243801,Tiger Leader: Neoprene Tactical Display
150010,244393,Tiger Leader: Upgrade Kit
150146,291042,Rattlebones: Insert Here Insert
150376,274991,Dead of Winter: 121 Piece Upgrade Kit
150376,305728,Dead of Winter: A Crossroads Game – e-Raptor Complete Tokens Set (134 pcs)
150376,309454,Dead of Winter: A Crossroads Game – e-Raptor Insert
150376,207908,Dead of Winter: Broken Token Organizer
150376,348615,Dead of Winter: Crossroads – The GiftForge Insert
150376,236700,Dead of Winter: e-Raptor Organizer
150376,265059,Dead of Winter: Folded Space Insert
150376,334894,Dead of Winter: Laserox Dead Organizer
150376,180814,Dead of Winter: Quick-Start Insert
150376,271626,Dead of Winter: The Game Doctors Insert
150376,272261,Dead of Winter: Tower Rex Organizer
150484,182530,Secrets of the Lost Tomb: Core Adventurers Miniatures
150484,266178,Secrets of the Lost Tomb: Core Bosses Miniatures
150484,266319,Secrets of the Lost Tomb: Epic Upgrade Dice
150658,208126,Pandemic: The Cure – Character Meeples
150926,170050,Roll Through the Ages: Iron Age – Fate Dice
150997,322280,Shadows of Brimstone Revised Core Sets Upgrade Kit
150997,213562,Shadows of Brimstone: Corpse Piles
150997,216039,Shadows of Brimstone: Deluxe Dark Stone Set
150997,216166,Shadows of Brimstone: Grizzly Bear
150997,216137,Shadows of Brimstone: Kickstarter Custom Dice
150997,192980,Shadows of Brimstone: Resin 3D Depth Track
150997,285935,Shadows of Brimstone: Resin Bandida (Female Bandido)
150997,285932,Shadows of Brimstone: Resin Crates and Barrels Terrain Set
150997,285937,Shadows of Brimstone: Resin Female Gunslinger
150997,285938,Shadows of Brimstone: Resin Female Indian Scout
150997,289079,Shadows of Brimstone: Resin Female Lawman
150997,285939,Shadows of Brimstone: Resin Female Rancher #2
150997,285940,Shadows of Brimstone: Resin Female U.S. Marshal
150997,285941,Shadows of Brimstone: Resin Male Gunslinger #2
150997,289078,Shadows of Brimstone: Resin Male Rancher
150997,351158,Shadows of Brimstone: Resin Master Samurai
150997,285942,Shadows of Brimstone: Resin Nun
150997,286525,Shadows of Brimstone: Resin Piano Player
150997,285943,Shadows of Brimstone: Resin Saloon Girl #2
150997,286528,Shadows of Brimstone: Resin Special Enemy 'Fast Draw' Jeb Scafford
150997,243124,Shadows of Brimstone: Resin Special Enemy Black Fang War Shaman
150997,285949,Shadows of Brimstone: Resin Special Enemy Hellfire Witch
150997,285950,Shadows of Brimstone: Resin Special Enemy Vampire Lord
150997,285951,"Shadows of Brimstone: Resin Special Enemy Wasteland Warmaster Celarrius Drakoth, Betrayer of the Empire"
150997,243125,Shadows of Brimstone: Resin Special Enemy Werewolf Pack Master
150997,285953,Shadows of Brimstone: Resin Special Wandering Samurai Ronin
150997,260558,Shadows of Brimstone: Resin Specialty Ally Dogs
150997,260556,Shadows of Brimstone: Resin Specialty Ally Indian Brave
150997,260555,Shadows of Brimstone: Resin Specialty Ally Loco
150997,260557,Shadows of Brimstone: Resin Specialty Ally Mutant Blacksmith
150997,289067,Shadows of Brimstone: Resin Veteran Gunslinger
150997,325030,Shadows of Brimstone: Resin Veteran Preacher
150997,289072,Shadows of Brimstone: Resin Veteran Saloon Girl with Void Hammer
150997,285946,Shadows of Brimstone: Special Enemy Crimson Hand Inquisitor
150997,286530,Shadows of Brimstone: The Lost Marshals Miniature Set
151004,400987,Smash Up: GeekUp Bit Set
151007,183351,Pathfinder Adventure Card Game: Adventure Mat
151007,274250,Pathfinder Adventure Card Game: Broken Token Organizer
151007,275983,Pathfinder Adventure Card Game: Broken Token Organizer – Extra Dividers
151007,320952,Pathfinder Adventure Card Game: Laserox Rune Lords Organizer
151022,287274,Baseball Highlights: 2045 – 60 Piece Upgrade Kit
151022,197139,Baseball Highlights: 2045 – Double Player Play Mat
151022,239521,Baseball Highlights: 2045 – EGG Tournament Kit
151022,197140,Baseball Highlights: 2045 – Single Player Play Mat
151247,165097,Greed: Wooden Development Markers
151347,225614,"Millennium Blades: ""Game of the Millennium"" Upgrade Pack"
151347,335831,Millennium Blades: Collusion – Special Edition Playmat
151347,335830,Millennium Blades: Special Edition Playmat
151377,376388,Thurn and Taxis: 3D Printed Post Offices/Houses
152053,205135,Lagoon: Land of Druids - Druid Faction: Bear
152241,202007,Ultimate Werewolf: ArtPack
152241,156293,Ultimate Werewolf: Character Meeples
152242,202007,Ultimate Werewolf: ArtPack
152470,277568,Fief: France – The Lords Miniatures
152470,171870,Fief: France 1429 – Buildings Pack
152470,171869,Fief: France 1429 – Medieval Metal Coin Set
152470,280609,Fief: France Edition – Kickstarter Upgrade Kit
152899,240588,Pixel Tactics: Playmat
153113,235233,Slaughterball: Dice Bag
153113,216395,Slaughterball: Dice Pack #1 – Carnage
153113,218581,Slaughterball: Dice Pack #2 – Nemesis
153113,218582,Slaughterball: Dice Pack #3 – Swords of Damocles
153113,218583,Slaughterball: Dice Pack #4 – Valkyries
153113,218584,Slaughterball: Dice Pack #5 – Fury
153113,218585,Slaughterball: Dice Pack #6 – Gruesomes
153113,218586,Slaughterball: Dice Pack #7 – Katanas
153113,218587,Slaughterball: Dice Pack #8 – Legion
153113,391079,Slaughterball: Dry-Erase Scoreboard
153113,395303,Slaughterball: Plastic Token Set 1
153425,272815,North Wind: Insert Here Insert
153703,201034,Darkest Night: Hero Cards
153703,182342,Darkest Night: Necromancer Stand-up and Dice Tower
153757,171632,Nika: Corinthian Helmet Turn Marker
153757,171633,Nika: Strategy Guide
153938,295522,Camel Up: Insert Here Insert
153938,352421,Camel Up: Meeple Source 5-Piece Set of Character Camels
154094,271752,Carcassonne: Tower Rex Organizer
154203,281698,Imperial Settlers: Folded Space Insert
154203,334741,Imperial Settlers: reDrewno Insert
154203,271318,Imperial Settlers: Broken Token Organizer
154203,273459,Imperial Settlers: Broken Token Organizer – Extra Dividers
154203,170533,Imperial Settlers: Character Meeples Scoring Markers
154203,236207,Imperial Settlers: Character Set
154203,325278,Imperial Settlers: Folded Space Insert (Second edition)
154203,189470,Imperial Settlers: GameGuard Organizer
154203,316248,Imperial Settlers: GeekUp Bit Set
154203,256340,Imperial Settlers: Global Village Cards
154203,295529,Imperial Settlers: Go7 Game Insert
154203,248892,Imperial Settlers: In-store Event Kit 2017
154203,244351,Imperial Settlers: In-store Event Kit 2018
154203,247389,Imperial Settlers: In-store Event Kit 2018 – Administration Alternate Artwork Cards
154203,247388,Imperial Settlers: In-store Event Kit 2018 – Pyramid Alternate Artwork Cards
154203,247386,Imperial Settlers: In-store Event Kit 2018 – Raid Alternate Artwork Cards
154203,247387,Imperial Settlers: In-store Event Kit 2018 – Trade Route Alternate Artwork Cards
154203,326935,Imperial Settlers: Laserox Settler's Sortiment Insert
154203,269744,Imperial Settlers: Panoramic Cards
154203,261702,Imperial Settlers: Playmat
154203,378767,Imperial Settlers: Spielmaterial.de Upgrade
154203,365832,Imperial Settlers: Tower Rex Organizer
154203,295883,Imperial Settlers: WarBox Insert
154203,257607,Imperial Settlers: Wooden shields and swords with stickers
154259,156248,Province: Mini Meeples
154259,156499,Province: Storage Bag
154386,272873,Medieval Academy: Broken Token Bits Box
154458,271977,Akrotiri: Insert Here Insert
154509,378770,Kingsport Festival: Spielmaterial.de Upgrade
154582,161370,Lords of the Sand: God Assembly Ability Marker Cards
154583,161368,Crimson Sun: Action Marker Cards
154634,163638,Yardmaster: Heisenberg Heist Expansion
154634,169105,Yardmaster: Wooden Tokens
154825,248128,Arkwright: Factory Goods Tokens
154825,313596,Arkwright: Meeple Realty Insert
154825,199249,Arkwright: Second edition upgrade kit
154910,240924,Darklight: Memento Mori – Boss Pack Supplement
154910,359656,Darklight: Memento Mori – Saim Lab Insert
155065,368820,Lifeform: Playmat
155068,175544,Arcadia Quest: Coin Pack
155068,188675,Arcadia Quest: Extra Dice
155068,177780,Arcadia Quest: Go7 Game Insert
155068,188674,Arcadia Quest: Guild Dice
155068,181677,Arcadia Quest: Metal Coins
155068,396233,Arcadia Quest: Pearlescent Dice
155068,218687,Arcadia Quest: Plastic Token Pack
155068,175543,Arcadia Quest: Wound Token Pack
155122,267003,"1066, Tears to Many Mothers: Playmat"
155122,368765,"1066, Tears to Many Mothers: Solo Dial"
155362,193650,Ca$h 'n Guns (second edition): Cthulhu Promo Character
155426,271424,Castles of Mad King Ludwig: Broken Token Organizer
155426,271628,Castles of Mad King Ludwig: Mad King Organizer
155426,272014,Castles of Mad King Ludwig: Meeple Realty Insert
155451,257384,Guild Ball: Falconer's Guild Launch Pack
155451,263400,Guild Ball: Navigator Guild – Windfinder Alternate Art
155451,257386,Guild Ball: Ratcatcher's Guild Launch Pack
155463,184859,DC Comics Deck-Building Game: Forever Evil – Playmat
155689,170029,Dungeons & Dragons: Attack Wing – Base & Peg Pack
155689,173333,Dungeons & Dragons: Attack Wing – Template Set
155689,171736,Dungeons & Dragons: Attack Wing Dice Set
155703,315724,Evolution: Climate – Climbing Alternate Art Promo Pack
155703,212760,Evolution: Climate – Conversion Kit
155703,267891,Evolution: Climate – Long Neck Alternate Artwork Promo Pack
155703,308161,Evolution: Foiled Promo Card Pack #1
155703,308163,Evolution: Foiled Promo Card Pack #2
155703,308164,Evolution: Foiled Promo Card Pack #3
155703,326327,Evolution: Hard Shell Alternative Art
155703,306198,Evolution: Laserox Darwin's Coffer Organizer
155703,223313,Evolution: Ready to Dive Deeper?
155703,290479,Evolution: Symbiosis Alternate Art Card
155703,245105,Evolution: T-Rex Meeple
155703,188061,Evolution: Trait Card Deck
155703,354926,Evolution: Warning Call Alternate Art Card
155703,257271,Evolution: Watering Hole Playmat and Dino Stickers
155708,162639,Tiny Epic Defenders: Character Meeples – Original 15 Heroes
155708,163185,Tiny Epic Defenders: Character Meeples – Original 8 Epic Foes
155708,203606,Tiny Epic Defenders: Playmat
155708,181454,Tiny Epic Defenders: Set of Character Meeples (Heroes & Foes)
155708,341342,Tiny Epic Game Haul Carrier
155754,162014,Panzer Grenadier: Desert Rat Division
155802,167967,Korrigans: Bag and Tokens
155821,367209,Inis: Laserox organizer
155821,271398,Inis: Tower Rex Organizer
155873,217883,Power Grid: Deluxe Compatibility Kit
155873,343311,Power Grid: Meeple Source 132-Piece Building Upgrade Kit
155987,337367,Abyss: Folded Space Insert
155987,334536,Abyss: reDrewno Insert
155987,369306,Abyss: Card Sleeves
155987,292147,Abyss: Playmat
156108,382541,Solo Fluxx Playmat
156129,253963,Deception: Murder in Hong Kong – Upgrade Kit
156138,198759,Happy Pigs: Alternate Reproduction Tokens
156138,196801,Happy Pigs: Ducks
156138,204815,Happy Pigs: Farm Friends
156138,272814,Happy Pigs: Insert Here Insert
156138,194501,Happy Pigs: Penguins
156266,201624,Apex Theropod Deck-Building Game: Exotic Predators Add-On – Quetzalcoatlus & Sarcosuchus Expansion Cards
156372,287387,Heart of Crown: Fairy Garden – Acrylic Standees
156372,287388,Heart of Crown: Fairy Garden – Foil Card Set
156372,287386,Heart of Crown: Fairy Garden – Metal Coin Complete Set
156372,287385,Heart of Crown: Fairy Garden – Metal Coin Upgrade Set
156372,287390,Heart of Crown: Playmat
156442,319435,Asking for Trobils: Insert Here Insert
156442,361042,Asking for Trobils: Metal Coins
156442,244594,Asking for Trobils: RIFF RAFF Cards
156442,361041,Asking for Trobils: The Big Box
156443,279737,AVGhost:  Paranormal Investigation –  Glow in the Dark Ghost Miniatures
156455,263218,Viticulture / Tuscany: 51 Painted Character Meeples
156455,263217,Viticulture: 37 Painted Character Meeples
156455,314067,Viticulture: LaserLand Mini Wine Bottles in a Wooden Crate
156496,305854,March of the Ants: All the Meeples
156548,219878,Super Dungeon Explore: Heart and Potion Token Pack
156566,303520,Lords of Xidit: BGExpansions Bastion Bard
156689,252143,Legendary: A Marvel Deck Building Game – Unleash the Power of the Cosmic Cube Promo
156689,271499,Legendary: Villains – A Marvel Deck-Building Game – Villains Organizer
156689,272793,Legendary: Villains – A Marvel Deck-Building Game – Villains Organizer – Extra Dividers
156714,255892,Doomtown: Reloaded – Full Art Servitor Cards
156714,174636,Doomtown: Reloaded – Ghost Rock Tokens
156786,336822,Munchkin: Level Counter Bookmark
157322,169133,Dice Brewing: Player Mats
157354,366921,Five Tribes expansions: MeeplesUpgrade  Upgrade Kit
157354,309457,Five Tribes: e-Raptor Insert
157354,175539,Five Tribes: Fakirs
157354,266301,Five Tribes: Folded Space Insert
157354,272813,Five Tribes: Insert Here Insert
157354,295518,Five Tribes: Meeple Realty Insert
157354,366920,Five Tribes: MeeplesUpgrade Upgrade Kit
157354,336143,Five Tribes: Moedas & Co. Metal Coins
157354,348634,Five Tribes: The GiftForge Insert
157354,365811,Five Tribes: Tower Rex Organizer
157395,282181,Aetherium: House Ikaru Token Set
157395,282187,Aetherium: RezX Token Set
157406,215993,LACORSA Grand Prix Game: French Racing Blue Racecar Set
157406,295375,LACORSA Grand Prix Game: JPS Black Racecar Set
157526,367869,Viceroy: Custom Box Sleeve
157526,179681,Viceroy: Gems
157526,273464,Viceroy: Insert Here Insert
157526,179680,Viceroy: Playmat
157526,363279,Viceroy: Solo Variant Die
157653,286442,Illusions of Glory: Upgrade Kit
157917,165495,The Lord of the Ice Garden: Castle
157917,309483,The Lord of the Ice Garden: e-Raptor Insert
157917,165499,The Lord of the Ice Garden: Magical Reserve 3D Markers
157917,165498,The Lord of the Ice Garden: Nightmare 3D Markers
157917,165496,The Lord of the Ice Garden: Red Towers
157917,165497,The Lord of the Ice Garden: Vuko 3D Markers
157969,309475,Sheriff of Nottingham: e-Raptor Insert
157969,291022,Sheriff of Nottingham: Insert Here Insert
157969,177124,Sheriff of Nottingham: Playmat
157969,182275,Sheriff of Nottingham: Sheriff Miniature
157969,378776,Sheriff of Nottingham: Spielmaterial.de Upgrade
157969,348651,Sheriff of Nottingham: The GiftForge Insert
158098,45682,Deluxe Space Battle Maps
158122,158127,Migration: Book II – Linen Ocean Map
158122,158128,Migration: Book II – Token Stickers
158130,346626,Tanto Cuore: 10th Anniversary Setup Playmat
158130,272561,Tanto Cuore: Broken Token Organizer
158130,334967,Tanto Cuore: Deck Box – Claire
158130,334968,Tanto Cuore: Deck Box – International
158130,346627,Tanto Cuore: Five Themed Playmats
158130,276162,Tanto Cuore: Foil Card Set of the Promo Cards from Tanto Cuore 1-4
158130,396620,Tanto Cuore: Kirka Von Heidemann Alternate Art Promo Card
158130,207829,Tanto Cuore: Oktoberfest – Gina Kersten Alternate Art Promo Card
158130,334956,Tanto Cuore: Playmat – Adorianna
158130,334958,Tanto Cuore: Playmat – Anja
158130,334957,Tanto Cuore: Playmat – Beer Stand
158130,334963,Tanto Cuore: Playmat – Canada
158130,334960,Tanto Cuore: Playmat – France
158130,334961,Tanto Cuore: Playmat – Germany
158130,334962,Tanto Cuore: Playmat – Italy
158130,334955,Tanto Cuore: Playmat – Laura
158130,334959,Tanto Cuore: Playmat – Nadja
158130,334954,Tanto Cuore: Playmat – Pauline
