game_id,id,value
187273,272768,The Dresden Files Cooperative Card Game: Broken Token Organizer
187273,275024,The Dresden Files Cooperative Card Game: Broken Token Organizer – Extra Dividers
187273,361920,The Dresden Files Cooperative Card Game: LITKO Game Upgrade Set
187353,223646,Marvel Dice Masters: Civil War – Captain Marvel: Captain Carol Danvers Alternate Art Promo
187353,223647,Marvel Dice Masters: Civil War – Iron Man: Pro-Reg Alternate Art Promo
187353,200946,Marvel Dice Masters: Civil War – Playmat
187353,223643,Marvel Dice Masters: Civil War – Vibranium Shield: Symbol of Freedom Alternate Art Promo
187353,268350,Marvel Dice Masters: Deadpool Promo Card
187377,255178,Vikings Gone Wild: Big Storage Box
187377,306283,Vikings Gone Wild: WarBox Insert
187488,234947,Dark Mages: Female Character Pack
187617,286267,Nemo's War: Cloth Bundle
187645,364909,Star Wars: Rebellion – e-Raptor Insert
187645,287906,Star Wars: Rebellion – Foam Tray Set
187645,267463,Star Wars: Rebellion – Folded Space Insert
187645,295527,Star Wars: Rebellion – Insert Here Insert
187645,334032,Star Wars: Rebellion – Laserox Rebell Organizer
187645,366940,Star Wars: Rebellion – LuckyPlayer Battle Playmat
187645,387375,Star Wars: Rebellion – Meeple Realty Insert
187645,201256,Star Wars: Rebellion – Quick-Start Insert
187645,342723,Star Wars: Rebellion – The Dicetroyers Organizer
187645,348614,Star Wars: Rebellion – The GiftForge Insert
187645,220585,Star Wars: Rebellion – Zen Bins Storage
187675,209882,Ogoola Karuta: Textile Gameboard
187680,228666,Quests of Valeria: Playmat
187687,183351,Pathfinder Adventure Card Game: Adventure Mat
187687,274250,Pathfinder Adventure Card Game: Broken Token Organizer
187687,275983,Pathfinder Adventure Card Game: Broken Token Organizer – Extra Dividers
187687,320952,Pathfinder Adventure Card Game: Laserox Rune Lords Organizer
187687,392564,Pathfinder Battles: Long Wood Table
187700,223867,GKR: Heavy Hitters – Faction-Themed Defense Dice
187700,223860,GKR: Heavy Hitters – Waterslide Decals
187976,268540,Covil: Sticker Pack
187988,309036,Pyramid Arcade: Bonus Cards
187988,329766,Pyramid Arcade: Bonus Cards 2
187988,236394,Pyramid Arcade: Chessboard Bandana
187988,324089,Pyramid Arcade: Dice
188076,188082,Taluva: First Player Spinner
188076,188083,Taluva: Travel Bag
188164,331651,Air Leader Dice Pack
188164,331650,Air Leader Flame Markers
188164,205370,B-17 Flying Fortress: Minis and Board Expansion
188164,308270,Combo Errata Pack
188181,218775,Avignon: Playmat
188181,337193,Avignon: Wooden Card Box
188181,337196,Avignon: Wooden Map
188547,315957,Maximum Apocalypse Play Mat
188834,228781,Secret Hitler: The Trump Pack
188834,206319,Secret Hitler: Trump
188866,359320,Unangenehme Gäste: wiederbeschreibbare Bögen
188920,374740,This War of Mine + expansions: Spike Craft Insert
188920,374741,This War of Mine: Spike Craft Insert
188920,283611,This War of Mine: The Board Game – Blank Tokens
188920,366738,This War of Mine: The Board Game – Companion App
188920,309484,This War of Mine: The Board Game – e-Raptor Insert
189052,272777,Sea of Clouds: Broken Token Organizer
189154,257261,The Ninth World: Playmap
189190,376019,9 Lives: Components Upgrade
189350,306576,Starving Artists: Canvas Rack Box
189350,220143,Starving Artists: Playmat
189351,256725,Virus: Walls System
189660,306369,XenoShyft: Broken Token Organizer
189848,336822,Munchkin: Level Counter Bookmark
189932,312919,Tyrants of the Underdark: Saim Lab Insert
190400,282005,Aventuria: Ausbauset
190400,200860,Aventuria: Bonus-Schicksalspunkte
190400,335594,Aventuria: Hero Dice Set
190400,353843,Aventuria: Hero Token
190400,335504,Aventuria: Kartentruhe
190400,200861,Aventuria: Playmat
190400,336679,Aventuria: Spielmarken-Set – Adventure Pack
190400,336678,Aventuria: Spielmarken-Set – Blood Pack
190400,336681,Aventuria: Spielmarken-Set – Forest Pack
190400,336680,Aventuria: Spielmarken-Set – Threat Pack
190400,335500,Aventuria: Spielmatte
190400,335495,Aventuria: Spielmatte Abenteuermodus
190400,335575,Aventuria: Sticker Set – Wheel of Life Alternative Heroes
190400,289181,Aventuria: Wheel of Life
190572,357119,1941: Race to Moscow – Axis Aircraft Expansion
190572,357300,1941: Race to Moscow – Giant Playing Mat
190572,358258,1941: Race to Moscow – Larger Locomotive Miniatures
191189,334732,Aeon's End: reDrewno Insert
191189,239115,Aeon's End: Accessory Pack
191189,380518,Aeon's End: Accessory Pack 5
191189,214320,Aeon's End: Bane Sire
191189,272772,Aeon's End: Broken Token Organizer
191189,274246,Aeon's End: Broken Token Organizer – Extra Dividers
191189,303579,Aeon's End: e-Raptor Insert
191189,309178,Aeon's End: Folded Space Insert
191189,291169,Aeon's End: Insert Here Insert
191189,279772,Aeon's End: Legacy – Broken Token Organizer
191189,313778,Aeon's End: Market Setup Cards
191189,243337,Aeon's End: Playmat
191189,243338,Aeon's End: Update Pack
191189,289104,Aeon's End: WarBox Insert
191201,260867,Siege of Sunfall: Playmat
191231,250716,Via Nebula: Promo Figure
191301,297163,The Walking Dead: All Out War – Badge & Guns (Mantic Points Model)
191301,296537,The Walking Dead: All Out War – Chain Link Fences Scenery Set
191301,296539,The Walking Dead: All Out War – Dale's RV
191301,260272,The Walking Dead: All Out War – Deluxe Gaming Mats
191301,261078,The Walking Dead: All Out War – Dice Booster
191301,296540,The Walking Dead: All Out War – Greene Family Farm Scenery Kit
191301,259768,The Walking Dead: All Out War – Michonne Character Card Alternate Art
191301,296538,The Walking Dead: All Out War – Premium Survivor Accessory Set
191301,288799,The Walking Dead: All Out War – Premium Walker Accessory Set
191301,296536,The Walking Dead: All Out War – Prison Tower Scenery Set
191301,261082,The Walking Dead: All Out War – Scenery Booster
191301,297171,The Walking Dead: All Out War – Walker Ronnie
191301,296535,The Walking Dead: All Out War – Woodbury House
191579,268350,Marvel Dice Masters: Deadpool Promo Card
191579,200944,Teenage Mutant Ninja Turtles Dice Masters: Dice Bag
191579,200943,Teenage Mutant Ninja Turtles Dice Masters: Playmat
191597,327830,Dale of Merchants: Playmat bag
191597,306793,Dale of Merchants: Update Pack
191612,310463,Skies Above The Reich: Mounted Maps – Formation Maps 3 & 4
191862,271931,Imhotep: Insert Here Insert
191862,282710,Imhotep: Playmat
191862,367087,KOSMOS Helper App
191876,244022,Ulm: Player Aid
191977,306391,The Castles of Burgundy: Folded Space Insert
191977,326373,The Castles of Burgundy: Folded Space Insert (Second edition)
191989,411222,GMT Games Errata Counters 2023
192116,286880,Cthulhu: A Deck Building Game – Playmat
192135,304186,Too Many Bones: 2019 Update Pack
192135,224900,Too Many Bones: Adventure Map
192135,241666,Too Many Bones: Adventure Map 2.0
192135,257758,Too Many Bones: Ally Pack
192135,408117,Too Many Bones: BrassMag Figures
192135,349908,Too Many Bones: Collapsible Dice Tower
192135,231298,Too Many Bones: Component Update Pack
192135,338906,Too Many Bones: Control ‘Ur Roll Dice Tray
192135,349928,Too Many Bones: Deluxe Playmat
192135,330266,Too Many Bones: Fireworks Boomer
192135,286419,Too Many Bones: Flip Chips
192135,378406,Too Many Bones: Gearloc Skeleton Promo Chips
192135,404826,Too Many Bones: Gearloc Tray (2-Pack)
192135,351147,Too Many Bones: German Language Pack
192135,330270,Too Many Bones: Like a Florist Tantrum
192135,350241,Too Many Bones: Modular Playmats
192135,330271,Too Many Bones: Nightmare Picket
192135,224901,Too Many Bones: Premium Health
192135,330263,Too Many Bones: Slasher Patches
192135,294829,Too Many Bones: Trove Chest
192135,369316,Too Many Bones: Tyrant and Gearloc Deluxe Storage
192153,287052,Pandemic: Reign of Cthulhu – Feldherr Inlay
192312,266750,Mr. Cabbagehead's Garden: Burlap Draw Bag
192312,266751,Mr. Cabbagehead's Garden: Playmat
192312,266752,Mr. Cabbagehead's Garden: Wooden Bee Tokens
192334,206267,Vikings on Board: Barrels
192401,291058,Dungeon Time: Insert Here Insert
192455,271955,First Martians: Adventures on the Red Planet – Insert Here Insert
192457,338716,Cry Havoc: e-Raptor Insert
192458,334634,51st State: Master Set – reDrewno Insert
192458,272782,51st State: Master Set – Broken Token Organizer
192458,274247,51st State: Master Set – Broken Token Organizer – Extra Dividers
192458,358512,51st State: Master Set – Engraved wooden components
192458,381794,51st State: Master Set – No Man's Land Area Playmat
192458,269754,51st State: Master Set – Playmat
192458,364631,51st State: Master Set – WarBox Insert
192458,221443,51st State: Master Set – Wooden Pawns and Stickers
192458,281698,Imperial Settlers: Folded Space Insert
192458,325278,Imperial Settlers: Folded Space Insert (Second edition)
192508,244446,The Goonies: Adventure Card Game – Playmat
192619,257215,Smiths of Winterforge: Metal Coins
192638,227135,Multiuniversum: Playmat
192663,180169,Fleet Commander: Deep Space
192713,327478,Ninja: Silent But Deadly – Rick Roll!
192713,356497,Ninja: Silent But Deadly – Stealth Pack
192722,323647,Cow Tiger Santa Claus: Blank Cards
192860,272775,Oceanos: Broken Token Organizer
192860,210814,Oceanos: Daisy Promo Submarine
192860,271949,Oceanos: Insert Here Insert
192860,272878,Oceanos: Treasure Chest
192906,297306,Heir to the Pharaoh: Upgraded Wooden Components
192984,242407,Revenge of the Dictators: Passports
193037,236700,Dead of Winter: e-Raptor Organizer
193037,265059,Dead of Winter: Folded Space Insert
193037,274933,Dead of Winter: The Long Night – 57 Piece Upgrade Kit
193037,334895,Dead of Winter: The Long Night – Dead Night Laserox Organizer
193037,309452,Dead of Winter: The Long Night – e-Raptor Insert
193037,270451,Dead of Winter: The Long Night – Long Winter Organizer
193037,273012,Dead of Winter: The Long Night – Quick-Start Insert
193037,271627,Dead of Winter: The Long Night – The Game Doctors Insert
193037,348616,Dead of Winter: The Long Night – The GiftForge Insert
193037,271876,Dead of Winter: The Long Night – Tower Rex Organizer
193212,218892,Chariot Race: Wooden Meeples
193428,340579,Street Fighter: The Miniatures Game – Map Pack
193483,238828,Dwar7s Fall: Magic Forest Game Mat
193483,238829,Dwar7s Fall: Meeple Stickers
193558,211880,The Oracle of Delphi: Boats
193670,312918,Darkest Night (Second edition): Saim Lab Insert
193670,271258,Darkest Night: Miniatures Set
193715,404049,Dungeons of Infinity: Deep Dungeon Dice Set
193715,404050,Dungeons of Infinity: Lux Armiger Coin Set
193728,326975,Pendragon: The Fall of Roman Britain – Battle Board
193738,334736,Great Western Trail: reDrewno Insert
193738,334747,Great Western Trail: reDrewno Overlay
193738,380322,Great Western Trail: BoardGameBoost Overlay
193738,328776,Great Western Trail: Coin-Cases
193738,243360,Great Western Trail: Drawstring Bags
193738,309434,Great Western Trail: e-Raptor Insert
193738,309604,Great Western Trail: e-Raptor Organizer
193738,267350,Great Western Trail: Folded Space Insert
193738,366935,Great Western Trail: Laserox Overlay
193738,326824,Great Western Trail: Laserox Western Vault insert
193738,369237,Great Western Trail: Moedas & Co. Metal Coins
193738,216277,Great Western Trail: Player Mat Overlay
193738,232365,Great Western Trail: Player Overlay with Backing Board
193738,380324,Great Western Trail: Rails to the North – BoardGameBoost Overlay w/Backboard
193738,366936,Great Western Trail: Rails to the North – Laserox Overlay
193738,334746,Great Western Trail: Rails to the North – reDrewno Overlay
193738,382561,Great Western Trail: Sloyca Insert
193738,268418,Great Western Trail: The Game Doctors Insert
193738,348638,Great Western Trail: The GiftForge Insert
193867,279924,1822: 3D-Printed Tile Holders
193867,378712,1822: Fix Pack
193867,316974,1822: The Railways of Great Britain – Deluxe Player Order Upgrade
193949,299157,Star Trek: Ascendancy – Andorian Dice Pack
193949,299158,Star Trek: Ascendancy – Andorian Escalation Pack
193949,293942,Star Trek: Ascendancy – Andorian Starbases
193949,233072,Star Trek: Ascendancy – Battle Stations Game Mat
193949,242226,Star Trek: Ascendancy – Borg Play Mat
193949,362978,Star Trek: Ascendancy – Breen Dice Pack
193949,362980,Star Trek: Ascendancy – Breen Escalation Pack
193949,246984,Star Trek: Ascendancy – Cardassian Dice Pack
193949,242224,Star Trek: Ascendancy – Cardassian Escalation Pack
193949,259454,Star Trek: Ascendancy – Cardassian Starbases
193949,370196,Star Trek: Ascendancy – Classic Enterprise Upgrade Pack
193949,370195,Star Trek: Ascendancy – Classic K7 Starbases
193949,370197,Star Trek: Ascendancy – Defiant Upgrade Pack
193949,362979,Star Trek: Ascendancy – Dominion Dice Pack
193949,362981,Star Trek: Ascendancy – Dominion Escalation Pack
193949,362982,Star Trek: Ascendancy – Dominion/Breen Starbase
193949,246981,Star Trek: Ascendancy – Federation Dice Pack
193949,232875,Star Trek: Ascendancy – Federation Escalation Pack
193949,259449,Star Trek: Ascendancy – Federation Starbases
193949,246985,Star Trek: Ascendancy – Ferengi Dice Pack
193949,242225,Star Trek: Ascendancy – Ferengi Escalation Pack
193949,259453,Star Trek: Ascendancy – Ferengi Starbases
193949,205487,Star Trek: Ascendancy – Game Mat
193949,246982,Star Trek: Ascendancy – Klingon Dice Pack
193949,232876,Star Trek: Ascendancy – Klingon Escalation Pack
193949,259451,Star Trek: Ascendancy – Klingon Starbases
193949,246983,Star Trek: Ascendancy – Romulan Dice Pack
193949,232877,Star Trek: Ascendancy – Romulan Escalation Pack
193949,259450,Star Trek: Ascendancy – Romulan Starbases
193949,306582,Star Trek: Ascendancy – Space Lane Dice
193949,206974,Star Trek: Ascendancy – Starbase Miniatures
193949,332135,Star Trek: Ascendancy – TinkeringPaws Insert
193949,299168,Star Trek: Ascendancy – Vulcan Dice Pack
193949,299167,Star Trek: Ascendancy – Vulcan Escalation Pack
193953,200363,Mistfall: Miniatures Pack
193981,277445,Downfall: Upsized Map Pack
194196,257381,Kharnage: The Hill Playmat
194392,272763,Moscow '41: Mounted Map
194517,368124,Super Fantasy Brawl: Feldherr Insert
194517,368438,Super Fantasy Brawl: Grandstands
194517,322822,Super Fantasy Brawl: Neoprene Kit
194517,368437,Super Fantasy Brawl: Team Base Rings
194517,357861,Super Fantasy Brawl: The Sleeve Kit
194517,357880,Super Fantasy Brawl: The Wizards Statues
194517,357879,Super Fantasy Brawl: Various plastic tokens
194594,353120,Dice Forge: Dice Tray
194594,353119,Dice Forge: Twinples
194607,337693,Mystic Vale: reDrewno Insert
194607,272758,Mystic Vale: Broken Token Organizer
194607,275027,Mystic Vale: Broken Token Organizer – Extra Dividers
194607,282921,Mystic Vale: GeekUp Bit Set
194655,386291,Santorini: Pantheon Upgrade Kit
194690,271973,Viral: Insert Here Insert
194810,204313,Marvel Universe Miniature Game: Avengers Markers
194810,204312,Marvel Universe Miniature Game: Spray Template
194812,204312,Marvel Universe Miniature Game: Spray Template
194812,204317,Marvel Universe Miniature Game: X-Men Markers
194813,204315,Marvel Universe Miniature Game: Guardians of the Galaxy Markers
194813,204312,Marvel Universe Miniature Game: Spray Template
194964,338855,Gold Metal Ship Pack
195180,322239,Universal Rule: Credit Trackers
195226,293364,Napoleon Saga: Battlefield Playmat
195242,319081,Tanks: Benghazi Game Mat
195242,212675,Tanks: Caen Game Mat
195242,219067,Tanks: Corn Fields Game Mat
195242,319082,Tanks: Desert 3 Game Mat
195242,320488,Tanks: El Guettar Game Mat
195242,338698,Tanks: Kasserine Pass Game Mat
195242,223537,Tanks: Minsk Game Mat
195242,205697,Tanks: Normandy Beach Game Mat
195242,230448,Tanks: Oasis Desert Game Mat
195242,332081,Tanks: Terrain Pack
195242,209316,Tanks: Token Set
195242,209051,Tanks: Villers Bocage Game Mat
195242,329562,World of Tanks Miniatures Game: Summer Game Mat – Prokhorovka
195421,221007,Near and Far: Character Meeples
195421,267454,Near and Far: Folded Space Insert
195421,360194,Near and Far: Insert Here Organizer
195421,229082,Near and Far: Metal Coins
195421,337584,Near and Far: Packturtles Meeples
195421,271625,Near and Far: The Game Doctors Insert
195560,296448,Wasteland Express Delivery Service: GeekUp Bag Set
195571,274249,Legendary Encounters: An Alien Deck Building Game – Encounters Organizer
195571,275562,Legendary Encounters: An Alien Deck Building Game – Encounters Organizer – Extra Dividers
195571,331833,Legendary Encounters: An Alien Deck Building Game – reDrewno Insert
195571,364905,Legendary Encounters: An Alien Deck Building Game – WarBox Insert
195856,340451,Bloodborne: The Card Game – e-Raptor Insert
195856,262973,Bloodborne: The Card Game – Hunter miniature
195856,319444,Bloodborne: The Card Game – Insert Here Insert
196202,184196,Rum & Bones: Coin Pack
196202,184197,Rum & Bones: Custom Dice
196217,368637,18Ireland: CUBE4ME / Rails on Board tile trays and stickers
196305,386430,Guildhall Fantasy: Box of Holding
196306,386430,Guildhall Fantasy: Box of Holding
196340,308351,Yokohama: Go7 Deluxe Insert
196340,272819,Yokohama: Insert Here Insert
196340,268230,Yokohama: Meeple Realty Insert
196340,402361,Yokohama: Premium Tokens
196340,378781,Yokohama: Spielmaterial.de Upgrade
196354,299177,Era of Tribes: Laserox Organizer
196354,290444,Era of Tribes: Metal Coins
196496,358654,Warfighter WWII: Wave 01 and 02 Card Dividers
196496,396796,Warfighter: 2023 Update Kit
196496,358634,Warfighter: Battle Packs Wave 3 Card Dividers
196496,313752,Warfighter: Dice Pack
196496,278961,Warfighter: The WWII Pacific Combat Card Game – Korean War Playmat
196496,215462,Warfighter: The WWII Tactical Combat Card Game – Expansion #14: USA Metal Soldier Miniatures
196496,215461,Warfighter: The WWII Tactical Combat Card Game – Expansion #15: UK Metal Soldier Miniatures
196496,215460,Warfighter: The WWII Tactical Combat Card Game – Expansion #16: German Metal Soldier Miniatures
196496,215459,Warfighter: The WWII Tactical Combat Card Game – Expansion #17: Russian Metal Soldier Miniatures
196496,214560,Warfighter: The WWII Tactical Combat Card Game – Expansion 13: Metal Tokens
196496,285055,Warfighter: The WWII Tactical Combat Card Game – Neoprene Mat
197070,233481,Massive Darkness: Chests & Pillars
197070,318693,Massive Darkness: Companion App
197070,318646,Massive Darkness: Doors & Bridges
197070,319588,Massive Darkness: Feldherr Foam Tray Set
197070,308346,Massive Darkness: Go7 Base Game Insert
197070,376387,Massive Darkness: Marble Dice
197070,232225,Massive Darkness: Plastic Token Set
197376,297590,Charterstone: Extra Board
197376,297591,Charterstone: Extra Coins
197376,243234,Charterstone: Large Painted Meeples
197376,243235,Charterstone: Realistic Resources
197405,224418,Tak: Arcanist's Board
197405,373879,Tak: Artificer's Metal Capstones
197405,224417,Tak: Cloth Board
197405,224415,Tak: Collector Coin
197405,373878,Tak: Daisies and Stone Board
197405,224419,Tak: Vintas Royal Capstone
197405,244915,Tak: Wolf and Hawk Capstones
197790,381305,Vinyl: Gold Edition – Upgrade Pack
197798,304723,The Depths of Durangrar: Expansion Set
197831,260506,Dark Souls: The Board Game – Darkroot Basin and Iron Keep Tile Set
197831,314738,Dark Souls: The Board Game – Extra Dice Pack
197831,314740,Dark Souls: The Board Game – Metal Aggro Coin
197831,348607,Dark Souls: The GiftForge Insert
198138,329267,Enchanters: Crystal Shards Set
198138,329266,Enchanters: Deluxe Storage Box
198138,329268,Enchanters: Neoprene Kit
198207,213852,Tin Soldiers in Action: Grassland Terrain Mat
198287,339382,Legends of Andor: The Last Hope – Laserox Organizer
198287,221380,Die Legenden von Andor: Die Feinde von Andor
198287,304994,Legends of Andor: The Last Hope – The Game Doctors Inlay
198412,293352,Twelve Heroes: Game Mat
198447,262287,Jim Henson's Labyrinth: The Board Game – Deluxe Play Pieces
198487,400987,Smash Up: GeekUp Bit Set
198525,216979,Lotus: 7 Frosted Lotus Petals
198609,234756,Fate of the Elder Gods: Playmat
198707,311245,Hostage Negotiator: Game Mat
198707,233979,Hostage Negotiator: Meeple Set 2
198773,345093,Codenames: Broken Token Organizer
198773,268232,Codenames: Meeple Realty Insert
198773,319074,Codenames: The Game Doctors Insert
198830,251291,"Heroes of Land, Air & Sea: Oversized Neoprene Playmat"
198832,373296,Legends Untold: Dragon Dice
198928,374422,Pandemic: GolonkoCrafts 3D Printed Tokens (Base Game Set)
198928,333624,Pandemic: Iberia – Folded Space Insert
198953,378573,Pax Renaissance: Florines Metálicos
198971,235688,Underlings of Underwing: Deluxe Play Mat – Solo
198971,235687,Underlings of Underwing: Deluxe Playmat
198994,322258,Hero Realms: D10 Faction Spindown Dice
198994,381229,Hero Realms: Man-at-Arms Alternate Art Promo Card
198994,203072,Hero Realms: Playmats
198994,291755,Hero Realms: Two-card Scoring promo
199042,383265,Harry Potter: Hogwarts Battle  – The GiftForge Insert
199042,258611,Harry Potter: Hogwarts Battle – Attack Tokens
199042,304299,Harry Potter: Hogwarts Battle – Card Sleeves
199042,258613,Harry Potter: Hogwarts Battle – Health Tokens
199042,258612,Harry Potter: Hogwarts Battle – Influence Tokens
199042,354426,Harry Potter: Hogwarts Battle – Laserox Hogwarts Battle Organizer
199042,378289,Harry Potter: Hogwarts Battle – Playmat
199223,337280,Bad Bones: Metal Minis
199242,313437,Mini Rogue: Cloth Bag
199242,345506,Mini Rogue: Dice Tray
199309,272402,Pathogenesis: Update Pack
199383,242531,Calimala: Deluxe Kit
199418,385565,Skeptics: Clue & Key Dice Pack
199418,385566,Skeptics: Dice Collection
199561,369044,"Sagrada: ""Floodgate"" Player Board"
199561,369121,"Sagrada: ""Kickstarter"" Player Board"
199561,287107,Sagrada: Broken Token Organizer
199561,358028,Sagrada: Folded Space Insert
199561,271965,Sagrada: Insert Here Insert
199561,344568,Sagrada: Laserox Insert
199561,324239,Sagrada: Replacement Dice
199561,365836,Sagrada: Tower Rex Organizer
199561,360063,Sagrahtzee
199723,292495,UltraQuest: Der Unterschlupf / The Hideout
199723,377065,UltraQuest: Karte Ultimor
199792,357969,Everdell: 3 Minute Library Promo Cards
199792,359324,Everdell: Berlin Brettspiel Con Promo Card
199792,332119,Everdell: BGInserts Insert
199792,336655,Everdell: Big Ol' Box of Storage
199792,367828,Everdell: Card Sleeve Set
199792,336653,Everdell: Click Clack's Upgrade Pack
199792,357725,Everdell: Court of Approval Alternate Art Promo Card
199792,296433,Everdell: Deluxe Occupied Tokens
199792,333825,Everdell: Deluxe Resource Vessels
199792,309259,Everdell: Dice Tower Alternate Art Cards
199792,309496,Everdell: e-Raptor Insert
199792,391158,Everdell: Eurohell 3D golden occupied Tokens
199792,391159,Everdell: Eurohell 3D open/closed signs
199792,391160,Everdell: Eurohell 3D spiderwebs
199792,391156,Everdell: Eurohell 3D-Token Point-Markers
199792,391157,Everdell: Eurohell occupied Tokens
199792,271285,Everdell: Ever Tree
199792,348633,Everdell: Everdell & Spirecrest GiftForge Insert
199792,353226,Everdell: Everdell for Everyone
199792,347397,Everdell: Expo Hall
199792,312895,Everdell: Folded Space Insert
199792,348594,Everdell: Game Boy Geek
199792,352844,Everdell: House of Peace Promo Card
199792,378870,Everdell: Internationale Spieltage SPIEL Promo Cards
199792,306518,Everdell: LaserLand Event Card Holders
199792,306519,Everdell: Laserland Walnut Resource Holders
199792,353225,Everdell: Lincoln and Nikki Alternate Art Cards
199792,330418,Everdell: Man vs Meeple Alternate Art Cards
199792,271839,Everdell: Metal Token Set
199792,370718,Everdell: Tantrum House Promo Card
199792,348549,Everdell: The GiftForge Base Insert
199792,385699,Everdell: The GiftForge Open sign
199792,385706,Everdell: The GiftForge Season board with small Ever Tree
199792,385707,Everdell: The GiftForge Special event card holder
199792,325823,Everdell: The Wanderer's Guide Alternate Art Promo Cards
199792,365825,Everdell: Tower Rex Organizer
199792,271840,Everdell: Wooden Twigs
199904,326976,Pericles: The Peloponnesian Wars – Player Notes & Map
200077,362336,Mint Works: Playmat
200111,249171,Cry Havoc: The Caravanserai
200147,293979,Kanagawa: Storm Token Tiles
200147,363144,Kanagawa: The GiftForge Insert
200326,202271,Superhero Solitaire: Origins 2016 Battery Playmat
200359,200363,Mistfall: Miniatures Pack
200454,228359,Planetarium: Player Mat Overlay
200511,358162,After the Empire: Gametrayz Component Tray
200511,329665,After the Empire: Neoprene mat set
200609,374914,Storyteller Cards: Fantasy – Character Sheet Pad
200609,374912,Storyteller Cards: Fantasy – DM Screen
200680,309444,Agricola (Revised Edition): e-Raptor Insert
200680,276446,Agricola (Revised Edition): Geekmod Insert
200680,272267,Agricola (Revised Edition): Tower Rex Organizer
200680,370440,Agricola 15th Anniversary Collector's Box
200680,329884,Agricola: Art Sleeves
200680,266245,Agricola: Folded Space Insert
200680,264122,Agricola: Kuhflecken Sticker
200680,358609,Agricola: Meeple Source Food
200680,273444,Agricola: Starting Player Token – Rooster
200680,348611,Agricola: The GiftForge Insert
200680,205557,Agricola: Upgrade Deck – Revised edition
200847,234356,Secrets: Authors
200853,360559,Habitats: Component Upgrades
200954,361599,Fields of Green: Game Makers Insert
201186,385829,Summit: The Board Game – Big Box
201186,354337,Summit: The Board Game – Sleeves
201509,340736,Dead Man's Doubloons: Cotton bag
201509,253863,Dead Man's Doubloons: Deluxe Components
